
-- Data for users
INSERT INTO "users" ("id", "email", "password_hash", "company_name", "created_at", "updated_at") VALUES (1, 'test@talos.com', '$2b$10$Fj/Qe12jhICJfciMi.OaX.HV2wvxBKF6D3chxkz7kKHtn87AhgC2e', 'Talos Demo Company', '2025-10-04 20:56:32', '2025-10-04 20:56:32') ON CONFLICT DO NOTHING;

-- Data for batches
INSERT INTO "batches" ("id", "user_id", "name", "total_resumes", "created_at") VALUES (1, 1, 'Batch 10/4/2025 4:02:08 PM', 6, '2025-10-04 21:02:08') ON CONFLICT DO NOTHING;
INSERT INTO "batches" ("id", "user_id", "name", "total_resumes", "created_at") VALUES (2, 1, 'Batch 10/20/2025 6:20:27 PM', 1, '2025-10-20 23:20:27') ON CONFLICT DO NOTHING;
INSERT INTO "batches" ("id", "user_id", "name", "total_resumes", "created_at") VALUES (3, 1, 'Batch 10/25/2025 2:57:09 PM', 2, '2025-10-25 19:57:09') ON CONFLICT DO NOTHING;
INSERT INTO "batches" ("id", "user_id", "name", "total_resumes", "created_at") VALUES (4, 1, 'Batch 10/25/2025 4:07:11 PM', 1, '2025-10-25 21:07:11') ON CONFLICT DO NOTHING;
INSERT INTO "batches" ("id", "user_id", "name", "total_resumes", "created_at") VALUES (5, 1, 'Batch 11/1/2025 12:52:06 PM', 5, '2025-11-01 17:52:06') ON CONFLICT DO NOTHING;
INSERT INTO "batches" ("id", "user_id", "name", "total_resumes", "created_at") VALUES (6, 1, 'Batch 11/1/2025 4:37:50 PM', 1, '2025-11-01 21:37:50') ON CONFLICT DO NOTHING;
INSERT INTO "batches" ("id", "user_id", "name", "total_resumes", "created_at") VALUES (7, 1, 'Batch 11/1/2025 4:47:24 PM', 5, '2025-11-01 21:47:24') ON CONFLICT DO NOTHING;
INSERT INTO "batches" ("id", "user_id", "name", "total_resumes", "created_at") VALUES (8, 1, 'Batch 11/1/2025 4:56:20 PM', 2, '2025-11-01 21:56:20') ON CONFLICT DO NOTHING;
INSERT INTO "batches" ("id", "user_id", "name", "total_resumes", "created_at") VALUES (9, 1, 'Batch 11/8/2025 3:52:42 PM', 1, '2025-11-08 21:52:42') ON CONFLICT DO NOTHING;
INSERT INTO "batches" ("id", "user_id", "name", "total_resumes", "created_at") VALUES (10, 1, 'Batch 11/8/2025 3:52:57 PM', 4, '2025-11-08 21:52:57') ON CONFLICT DO NOTHING;
INSERT INTO "batches" ("id", "user_id", "name", "total_resumes", "created_at") VALUES (11, 1, 'Batch 11/8/2025 3:56:39 PM', 3, '2025-11-08 21:56:39') ON CONFLICT DO NOTHING;
INSERT INTO "batches" ("id", "user_id", "name", "total_resumes", "created_at") VALUES (12, 1, 'Batch 11/8/2025 4:03:16 PM', 2, '2025-11-08 22:03:16') ON CONFLICT DO NOTHING;
INSERT INTO "batches" ("id", "user_id", "name", "total_resumes", "created_at") VALUES (13, 1, 'Batch 11/8/2025 4:03:54 PM', 2, '2025-11-08 22:03:54') ON CONFLICT DO NOTHING;
INSERT INTO "batches" ("id", "user_id", "name", "total_resumes", "created_at") VALUES (14, 1, 'Batch 11/8/2025 4:13:31 PM', 1, '2025-11-08 22:13:31') ON CONFLICT DO NOTHING;
INSERT INTO "batches" ("id", "user_id", "name", "total_resumes", "created_at") VALUES (15, 1, 'Batch 11/8/2025 4:19:41 PM', 1, '2025-11-08 22:19:41') ON CONFLICT DO NOTHING;
INSERT INTO "batches" ("id", "user_id", "name", "total_resumes", "created_at") VALUES (16, 1, 'Batch 11/8/2025 4:29:33 PM', 1, '2025-11-08 22:29:33') ON CONFLICT DO NOTHING;
INSERT INTO "batches" ("id", "user_id", "name", "total_resumes", "created_at") VALUES (17, 1, 'Batch 11/11/2025 7:27:02 AM', 1, '2025-11-11 13:27:02') ON CONFLICT DO NOTHING;
INSERT INTO "batches" ("id", "user_id", "name", "total_resumes", "created_at") VALUES (18, 1, 'Batch 11/15/2025 12:17:08 PM', 1, '2025-11-15 18:17:08') ON CONFLICT DO NOTHING;
INSERT INTO "batches" ("id", "user_id", "name", "total_resumes", "created_at") VALUES (19, 1, 'Batch 11/15/2025 12:17:25 PM', 5, '2025-11-15 18:17:25') ON CONFLICT DO NOTHING;
INSERT INTO "batches" ("id", "user_id", "name", "total_resumes", "created_at") VALUES (20, 1, 'Batch 11/15/2025 12:51:26 PM', 5, '2025-11-15 18:51:26') ON CONFLICT DO NOTHING;
INSERT INTO "batches" ("id", "user_id", "name", "total_resumes", "created_at") VALUES (21, 1, 'Batch 11/15/2025 1:04:57 PM', 5, '2025-11-15 19:04:57') ON CONFLICT DO NOTHING;
INSERT INTO "batches" ("id", "user_id", "name", "total_resumes", "created_at") VALUES (22, 1, 'Batch 11/15/2025 1:07:21 PM', 5, '2025-11-15 19:07:21') ON CONFLICT DO NOTHING;
INSERT INTO "batches" ("id", "user_id", "name", "total_resumes", "created_at") VALUES (23, 1, 'Batch 11/15/2025 1:14:00 PM', 5, '2025-11-15 19:14:00') ON CONFLICT DO NOTHING;
INSERT INTO "batches" ("id", "user_id", "name", "total_resumes", "created_at") VALUES (24, 1, 'Batch 11/15/2025 1:17:22 PM', 5, '2025-11-15 19:17:22') ON CONFLICT DO NOTHING;
INSERT INTO "batches" ("id", "user_id", "name", "total_resumes", "created_at") VALUES (25, 1, 'Batch 11/15/2025 1:29:47 PM', 5, '2025-11-15 19:29:47') ON CONFLICT DO NOTHING;
INSERT INTO "batches" ("id", "user_id", "name", "total_resumes", "created_at") VALUES (26, 1, 'Batch 11/15/2025 1:31:00 PM', 5, '2025-11-15 19:31:00') ON CONFLICT DO NOTHING;
INSERT INTO "batches" ("id", "user_id", "name", "total_resumes", "created_at") VALUES (27, 1, 'Batch 11/15/2025 2:18:52 PM', 5, '2025-11-15 20:18:52') ON CONFLICT DO NOTHING;
INSERT INTO "batches" ("id", "user_id", "name", "total_resumes", "created_at") VALUES (28, 1, 'Batch 11/15/2025 2:19:04 PM', 5, '2025-11-15 20:19:04') ON CONFLICT DO NOTHING;
INSERT INTO "batches" ("id", "user_id", "name", "total_resumes", "created_at") VALUES (29, 1, 'Batch 11/15/2025 2:23:20 PM', 5, '2025-11-15 20:23:20') ON CONFLICT DO NOTHING;
INSERT INTO "batches" ("id", "user_id", "name", "total_resumes", "created_at") VALUES (30, 1, 'Batch 11/15/2025 2:25:06 PM', 5, '2025-11-15 20:25:06') ON CONFLICT DO NOTHING;
INSERT INTO "batches" ("id", "user_id", "name", "total_resumes", "created_at") VALUES (31, 1, 'Batch 11/15/2025 2:27:36 PM', 5, '2025-11-15 20:27:36') ON CONFLICT DO NOTHING;
INSERT INTO "batches" ("id", "user_id", "name", "total_resumes", "created_at") VALUES (32, 1, 'Batch 11/15/2025 2:45:06 PM', 5, '2025-11-15 20:45:06') ON CONFLICT DO NOTHING;
INSERT INTO "batches" ("id", "user_id", "name", "total_resumes", "created_at") VALUES (33, 1, 'Batch 11/15/2025 2:53:26 PM', 5, '2025-11-15 20:53:26') ON CONFLICT DO NOTHING;
INSERT INTO "batches" ("id", "user_id", "name", "total_resumes", "created_at") VALUES (34, 1, 'Batch 11/15/2025 2:55:01 PM', 5, '2025-11-15 20:55:01') ON CONFLICT DO NOTHING;
INSERT INTO "batches" ("id", "user_id", "name", "total_resumes", "created_at") VALUES (35, 1, 'Batch 11/15/2025 2:59:13 PM', 1, '2025-11-15 20:59:13') ON CONFLICT DO NOTHING;
INSERT INTO "batches" ("id", "user_id", "name", "total_resumes", "created_at") VALUES (36, 1, 'Batch 11/15/2025 3:17:42 PM', 1, '2025-11-15 21:17:42') ON CONFLICT DO NOTHING;
INSERT INTO "batches" ("id", "user_id", "name", "total_resumes", "created_at") VALUES (37, 1, 'Batch 11/15/2025 3:20:51 PM', 1, '2025-11-15 21:20:51') ON CONFLICT DO NOTHING;
INSERT INTO "batches" ("id", "user_id", "name", "total_resumes", "created_at") VALUES (38, 1, 'Batch 11/15/2025 3:26:53 PM', 1, '2025-11-15 21:26:53') ON CONFLICT DO NOTHING;
INSERT INTO "batches" ("id", "user_id", "name", "total_resumes", "created_at") VALUES (39, 1, 'Batch 11/15/2025 3:28:42 PM', 1, '2025-11-15 21:28:42') ON CONFLICT DO NOTHING;
INSERT INTO "batches" ("id", "user_id", "name", "total_resumes", "created_at") VALUES (40, 1, 'Batch 11/15/2025 3:30:37 PM', 1, '2025-11-15 21:30:37') ON CONFLICT DO NOTHING;
INSERT INTO "batches" ("id", "user_id", "name", "total_resumes", "created_at") VALUES (41, 1, 'Batch 11/15/2025 3:31:00 PM', 1, '2025-11-15 21:31:00') ON CONFLICT DO NOTHING;
INSERT INTO "batches" ("id", "user_id", "name", "total_resumes", "created_at") VALUES (42, 1, 'Batch 11/15/2025 3:31:14 PM', 5, '2025-11-15 21:31:14') ON CONFLICT DO NOTHING;
INSERT INTO "batches" ("id", "user_id", "name", "total_resumes", "created_at") VALUES (43, 1, 'Batch 11/15/2025 3:32:03 PM', 5, '2025-11-15 21:32:03') ON CONFLICT DO NOTHING;
INSERT INTO "batches" ("id", "user_id", "name", "total_resumes", "created_at") VALUES (44, 1, 'Batch 11/15/2025 7:34:29 PM', 1, '2025-11-16 01:34:29') ON CONFLICT DO NOTHING;
INSERT INTO "batches" ("id", "user_id", "name", "total_resumes", "created_at") VALUES (45, 1, 'Batch 11/15/2025 7:36:39 PM', 1, '2025-11-16 01:36:39') ON CONFLICT DO NOTHING;
INSERT INTO "batches" ("id", "user_id", "name", "total_resumes", "created_at") VALUES (46, 1, 'Batch 11/15/2025 7:37:52 PM', 1, '2025-11-16 01:37:52') ON CONFLICT DO NOTHING;
INSERT INTO "batches" ("id", "user_id", "name", "total_resumes", "created_at") VALUES (47, 1, 'Batch 11/15/2025 7:39:45 PM', 1, '2025-11-16 01:39:45') ON CONFLICT DO NOTHING;
INSERT INTO "batches" ("id", "user_id", "name", "total_resumes", "created_at") VALUES (48, 1, 'Batch 11/16/2025 9:03:27 AM', 1, '2025-11-16 15:03:27') ON CONFLICT DO NOTHING;
INSERT INTO "batches" ("id", "user_id", "name", "total_resumes", "created_at") VALUES (49, 1, 'Batch 11/16/2025 9:25:57 AM', 1, '2025-11-16 15:25:57') ON CONFLICT DO NOTHING;
INSERT INTO "batches" ("id", "user_id", "name", "total_resumes", "created_at") VALUES (50, 1, 'Batch 11/19/2025 5:41:35 PM', 3, '2025-11-19 23:41:35') ON CONFLICT DO NOTHING;
INSERT INTO "batches" ("id", "user_id", "name", "total_resumes", "created_at") VALUES (51, 1, 'Batch 11/19/2025 5:57:16 PM', 5, '2025-11-19 23:57:16') ON CONFLICT DO NOTHING;
INSERT INTO "batches" ("id", "user_id", "name", "total_resumes", "created_at") VALUES (52, 1, 'Batch 11/19/2025 5:59:13 PM', 2, '2025-11-19 23:59:13') ON CONFLICT DO NOTHING;
INSERT INTO "batches" ("id", "user_id", "name", "total_resumes", "created_at") VALUES (53, 1, 'Batch 11/19/2025 6:01:25 PM', 5, '2025-11-20 00:01:25') ON CONFLICT DO NOTHING;
INSERT INTO "batches" ("id", "user_id", "name", "total_resumes", "created_at") VALUES (54, 1, 'Batch 11/19/2025 6:19:50 PM', 5, '2025-11-20 00:19:50') ON CONFLICT DO NOTHING;
INSERT INTO "batches" ("id", "user_id", "name", "total_resumes", "created_at") VALUES (55, 1, 'Batch 11/19/2025 6:50:04 PM', 1, '2025-11-20 00:50:04') ON CONFLICT DO NOTHING;
INSERT INTO "batches" ("id", "user_id", "name", "total_resumes", "created_at") VALUES (56, 1, 'Initial Talent Pool', 15, '2025-12-06 02:30:28') ON CONFLICT DO NOTHING;
INSERT INTO "batches" ("id", "user_id", "name", "total_resumes", "created_at") VALUES (57, 1, 'Initial Talent Pool', 15, '2025-12-06 02:30:50') ON CONFLICT DO NOTHING;
INSERT INTO "batches" ("id", "user_id", "name", "total_resumes", "created_at") VALUES (58, 1, 'Batch 12/6/2025 10:49:06 AM', 4, '2025-12-06 16:49:06') ON CONFLICT DO NOTHING;
INSERT INTO "batches" ("id", "user_id", "name", "total_resumes", "created_at") VALUES (59, 1, 'Batch 12/15/2025 5:40:32 PM', 1, '2025-12-15 23:40:32') ON CONFLICT DO NOTHING;
INSERT INTO "batches" ("id", "user_id", "name", "total_resumes", "created_at") VALUES (60, 1, 'Batch 12/15/2025 5:41:55 PM', 1, '2025-12-15 23:41:55') ON CONFLICT DO NOTHING;
INSERT INTO "batches" ("id", "user_id", "name", "total_resumes", "created_at") VALUES (61, 1, 'Batch 12/15/2025 5:50:15 PM', 1, '2025-12-15 23:50:15') ON CONFLICT DO NOTHING;
INSERT INTO "batches" ("id", "user_id", "name", "total_resumes", "created_at") VALUES (62, 1, 'Batch 12/15/2025 5:54:21 PM', 1, '2025-12-15 23:54:21') ON CONFLICT DO NOTHING;
INSERT INTO "batches" ("id", "user_id", "name", "total_resumes", "created_at") VALUES (63, 1, 'Batch 12/15/2025 5:55:11 PM', 1, '2025-12-15 23:55:11') ON CONFLICT DO NOTHING;
INSERT INTO "batches" ("id", "user_id", "name", "total_resumes", "created_at") VALUES (64, 1, 'Batch 12/15/2025 6:03:58 PM', 1, '2025-12-16 00:03:58') ON CONFLICT DO NOTHING;
INSERT INTO "batches" ("id", "user_id", "name", "total_resumes", "created_at") VALUES (65, 1, 'Batch 12/16/2025 6:25:43 PM', 1, '2025-12-17 00:25:43') ON CONFLICT DO NOTHING;
INSERT INTO "batches" ("id", "user_id", "name", "total_resumes", "created_at") VALUES (66, 1, 'Batch 12/16/2025 6:34:08 PM', 1, '2025-12-17 00:34:08') ON CONFLICT DO NOTHING;
INSERT INTO "batches" ("id", "user_id", "name", "total_resumes", "created_at") VALUES (67, 1, 'Batch 12/17/2025 6:22:33 PM', 5, '2025-12-18 00:22:33') ON CONFLICT DO NOTHING;
INSERT INTO "batches" ("id", "user_id", "name", "total_resumes", "created_at") VALUES (68, 1, 'Batch 12/17/2025 6:22:57 PM', 5, '2025-12-18 00:22:57') ON CONFLICT DO NOTHING;
INSERT INTO "batches" ("id", "user_id", "name", "total_resumes", "created_at") VALUES (69, 1, 'Batch 12/17/2025 6:29:12 PM', 1, '2025-12-18 00:29:12') ON CONFLICT DO NOTHING;
INSERT INTO "batches" ("id", "user_id", "name", "total_resumes", "created_at") VALUES (70, 1, 'Batch 12/17/2025 6:33:53 PM', 2, '2025-12-18 00:33:53') ON CONFLICT DO NOTHING;
INSERT INTO "batches" ("id", "user_id", "name", "total_resumes", "created_at") VALUES (71, 1, 'Batch 12/17/2025 6:45:28 PM', 2, '2025-12-18 00:45:28') ON CONFLICT DO NOTHING;
INSERT INTO "batches" ("id", "user_id", "name", "total_resumes", "created_at") VALUES (72, 1, 'Batch 12/17/2025 6:48:06 PM', 2, '2025-12-18 00:48:06') ON CONFLICT DO NOTHING;

-- Data for jobs
INSERT INTO "jobs" ("id", "user_id", "title", "description", "location", "required_years_experience", "vehicle_required", "position_type", "salary_min", "salary_max", "status", "created_at", "updated_at", "flexible_on_title", "company_name", "job_location_type", "city", "zip_code", "job_type", "pay_range_min", "pay_range_max", "pay_type", "expected_hours", "work_schedule", "benefits", "key_responsibilities", "qualifications_years", "qualifications_certifications", "qualifications_other", "education_requirements", "other_relevant_titles", "advancement_opportunities", "advancement_timeline", "company_culture", "ai_generated_description") VALUES (1, 1, 'Customer Service Representative', 'Talos HVAC is seeking a dedicated Customer Service Representative to join our growing team. In this role, you will be the first point of contact for our customers, handling inquiries, scheduling service appointments, and ensuring customer satisfaction.', 'Hybrid - Office/Remote', 0, 0, NULL, NULL, NULL, 'active', '2025-11-23 14:27:19', '2025-11-23 14:27:19', 1, NULL, NULL, NULL, NULL, NULL, NULL, NULL, NULL, NULL, NULL, NULL, NULL, NULL, NULL, NULL, NULL, NULL, 0, NULL, NULL, NULL) ON CONFLICT DO NOTHING;
INSERT INTO "jobs" ("id", "user_id", "title", "description", "location", "required_years_experience", "vehicle_required", "position_type", "salary_min", "salary_max", "status", "created_at", "updated_at", "flexible_on_title", "company_name", "job_location_type", "city", "zip_code", "job_type", "pay_range_min", "pay_range_max", "pay_type", "expected_hours", "work_schedule", "benefits", "key_responsibilities", "qualifications_years", "qualifications_certifications", "qualifications_other", "education_requirements", "other_relevant_titles", "advancement_opportunities", "advancement_timeline", "company_culture", "ai_generated_description") VALUES (2, 1, 'Admin Assistant', 'Talos HVAC is looking for an organized and detail-oriented Admin Assistant to support our operations team. This role is essential in keeping our office running smoothly and supporting our growing HVAC services business.', 'On-site', 0, 0, NULL, NULL, NULL, 'active', '2025-11-23 14:27:51', '2025-11-23 14:27:51', 1, NULL, NULL, NULL, NULL, NULL, NULL, NULL, NULL, NULL, NULL, NULL, NULL, NULL, NULL, NULL, NULL, NULL, 0, NULL, NULL, NULL) ON CONFLICT DO NOTHING;
INSERT INTO "jobs" ("id", "user_id", "title", "description", "location", "required_years_experience", "vehicle_required", "position_type", "salary_min", "salary_max", "status", "created_at", "updated_at", "flexible_on_title", "company_name", "job_location_type", "city", "zip_code", "job_type", "pay_range_min", "pay_range_max", "pay_type", "expected_hours", "work_schedule", "benefits", "key_responsibilities", "qualifications_years", "qualifications_certifications", "qualifications_other", "education_requirements", "other_relevant_titles", "advancement_opportunities", "advancement_timeline", "company_culture", "ai_generated_description") VALUES (3, 1, 'HVAC Service Technician', NULL, NULL, 5, 0, 'HVAC Service Technician', NULL, NULL, 'open', '2025-12-06 02:30:28', '2025-12-06 02:30:28', 1, NULL, NULL, NULL, NULL, NULL, NULL, NULL, NULL, NULL, NULL, NULL, NULL, NULL, NULL, NULL, NULL, NULL, 0, NULL, NULL, NULL) ON CONFLICT DO NOTHING;
INSERT INTO "jobs" ("id", "user_id", "title", "description", "location", "required_years_experience", "vehicle_required", "position_type", "salary_min", "salary_max", "status", "created_at", "updated_at", "flexible_on_title", "company_name", "job_location_type", "city", "zip_code", "job_type", "pay_range_min", "pay_range_max", "pay_type", "expected_hours", "work_schedule", "benefits", "key_responsibilities", "qualifications_years", "qualifications_certifications", "qualifications_other", "education_requirements", "other_relevant_titles", "advancement_opportunities", "advancement_timeline", "company_culture", "ai_generated_description") VALUES (4, 1, 'Lead HVAC Technician', NULL, NULL, 7, 0, 'Lead HVAC Technician', NULL, NULL, 'open', '2025-12-06 02:30:28', '2025-12-06 02:30:28', 1, NULL, NULL, NULL, NULL, NULL, NULL, NULL, NULL, NULL, NULL, NULL, NULL, NULL, NULL, NULL, NULL, NULL, 0, NULL, NULL, NULL) ON CONFLICT DO NOTHING;
INSERT INTO "jobs" ("id", "user_id", "title", "description", "location", "required_years_experience", "vehicle_required", "position_type", "salary_min", "salary_max", "status", "created_at", "updated_at", "flexible_on_title", "company_name", "job_location_type", "city", "zip_code", "job_type", "pay_range_min", "pay_range_max", "pay_type", "expected_hours", "work_schedule", "benefits", "key_responsibilities", "qualifications_years", "qualifications_certifications", "qualifications_other", "education_requirements", "other_relevant_titles", "advancement_opportunities", "advancement_timeline", "company_culture", "ai_generated_description") VALUES (5, 1, 'HVAC Dispatcher', NULL, NULL, 3, 0, 'HVAC Dispatcher', NULL, NULL, 'open', '2025-12-06 02:30:28', '2025-12-06 02:30:28', 1, NULL, NULL, NULL, NULL, NULL, NULL, NULL, NULL, NULL, NULL, NULL, NULL, NULL, NULL, NULL, NULL, NULL, 0, NULL, NULL, NULL) ON CONFLICT DO NOTHING;
INSERT INTO "jobs" ("id", "user_id", "title", "description", "location", "required_years_experience", "vehicle_required", "position_type", "salary_min", "salary_max", "status", "created_at", "updated_at", "flexible_on_title", "company_name", "job_location_type", "city", "zip_code", "job_type", "pay_range_min", "pay_range_max", "pay_type", "expected_hours", "work_schedule", "benefits", "key_responsibilities", "qualifications_years", "qualifications_certifications", "qualifications_other", "education_requirements", "other_relevant_titles", "advancement_opportunities", "advancement_timeline", "company_culture", "ai_generated_description") VALUES (6, 1, 'HVAC Sales Representative', NULL, NULL, 3, 0, 'HVAC Sales Representative', NULL, NULL, 'open', '2025-12-06 02:30:28', '2025-12-06 02:30:28', 1, NULL, NULL, NULL, NULL, NULL, NULL, NULL, NULL, NULL, NULL, NULL, NULL, NULL, NULL, NULL, NULL, NULL, 0, NULL, NULL, NULL) ON CONFLICT DO NOTHING;
INSERT INTO "jobs" ("id", "user_id", "title", "description", "location", "required_years_experience", "vehicle_required", "position_type", "salary_min", "salary_max", "status", "created_at", "updated_at", "flexible_on_title", "company_name", "job_location_type", "city", "zip_code", "job_type", "pay_range_min", "pay_range_max", "pay_type", "expected_hours", "work_schedule", "benefits", "key_responsibilities", "qualifications_years", "qualifications_certifications", "qualifications_other", "education_requirements", "other_relevant_titles", "advancement_opportunities", "advancement_timeline", "company_culture", "ai_generated_description") VALUES (7, 1, 'Bookkeeper', NULL, NULL, 3, 0, 'Bookkeeper', NULL, NULL, 'open', '2025-12-06 02:30:28', '2025-12-06 02:30:28', 1, NULL, NULL, NULL, NULL, NULL, NULL, NULL, NULL, NULL, NULL, NULL, NULL, NULL, NULL, NULL, NULL, NULL, 0, NULL, NULL, NULL) ON CONFLICT DO NOTHING;
INSERT INTO "jobs" ("id", "user_id", "title", "description", "location", "required_years_experience", "vehicle_required", "position_type", "salary_min", "salary_max", "status", "created_at", "updated_at", "flexible_on_title", "company_name", "job_location_type", "city", "zip_code", "job_type", "pay_range_min", "pay_range_max", "pay_type", "expected_hours", "work_schedule", "benefits", "key_responsibilities", "qualifications_years", "qualifications_certifications", "qualifications_other", "education_requirements", "other_relevant_titles", "advancement_opportunities", "advancement_timeline", "company_culture", "ai_generated_description") VALUES (8, 1, 'Administrative Assistant', NULL, NULL, 3, 0, 'Administrative Assistant', NULL, NULL, 'open', '2025-12-06 02:30:28', '2025-12-06 02:30:28', 1, NULL, NULL, NULL, NULL, NULL, NULL, NULL, NULL, NULL, NULL, NULL, NULL, NULL, NULL, NULL, NULL, NULL, 0, NULL, NULL, NULL) ON CONFLICT DO NOTHING;
INSERT INTO "jobs" ("id", "user_id", "title", "description", "location", "required_years_experience", "vehicle_required", "position_type", "salary_min", "salary_max", "status", "created_at", "updated_at", "flexible_on_title", "company_name", "job_location_type", "city", "zip_code", "job_type", "pay_range_min", "pay_range_max", "pay_type", "expected_hours", "work_schedule", "benefits", "key_responsibilities", "qualifications_years", "qualifications_certifications", "qualifications_other", "education_requirements", "other_relevant_titles", "advancement_opportunities", "advancement_timeline", "company_culture", "ai_generated_description") VALUES (9, 1, 'Customer Service Representative', NULL, NULL, 2, 0, 'Customer Service Representative', NULL, NULL, 'open', '2025-12-06 02:30:28', '2025-12-06 02:30:28', 1, NULL, NULL, NULL, NULL, NULL, NULL, NULL, NULL, NULL, NULL, NULL, NULL, NULL, NULL, NULL, NULL, NULL, 0, NULL, NULL, NULL) ON CONFLICT DO NOTHING;
INSERT INTO "jobs" ("id", "user_id", "title", "description", "location", "required_years_experience", "vehicle_required", "position_type", "salary_min", "salary_max", "status", "created_at", "updated_at", "flexible_on_title", "company_name", "job_location_type", "city", "zip_code", "job_type", "pay_range_min", "pay_range_max", "pay_type", "expected_hours", "work_schedule", "benefits", "key_responsibilities", "qualifications_years", "qualifications_certifications", "qualifications_other", "education_requirements", "other_relevant_titles", "advancement_opportunities", "advancement_timeline", "company_culture", "ai_generated_description") VALUES (10, 1, 'HVAC Apprentice', NULL, NULL, 0, 0, 'HVAC Apprentice', NULL, NULL, 'open', '2025-12-06 02:30:28', '2025-12-06 02:30:28', 1, NULL, NULL, NULL, NULL, NULL, NULL, NULL, NULL, NULL, NULL, NULL, NULL, NULL, NULL, NULL, NULL, NULL, 0, NULL, NULL, NULL) ON CONFLICT DO NOTHING;
INSERT INTO "jobs" ("id", "user_id", "title", "description", "location", "required_years_experience", "vehicle_required", "position_type", "salary_min", "salary_max", "status", "created_at", "updated_at", "flexible_on_title", "company_name", "job_location_type", "city", "zip_code", "job_type", "pay_range_min", "pay_range_max", "pay_type", "expected_hours", "work_schedule", "benefits", "key_responsibilities", "qualifications_years", "qualifications_certifications", "qualifications_other", "education_requirements", "other_relevant_titles", "advancement_opportunities", "advancement_timeline", "company_culture", "ai_generated_description") VALUES (11, 1, 'HVAC Service Technician', NULL, NULL, 5, 0, 'HVAC Service Technician', NULL, NULL, 'open', '2025-12-06 02:30:50', '2025-12-06 02:30:50', 1, NULL, NULL, NULL, NULL, NULL, NULL, NULL, NULL, NULL, NULL, NULL, NULL, NULL, NULL, NULL, NULL, NULL, 0, NULL, NULL, NULL) ON CONFLICT DO NOTHING;
INSERT INTO "jobs" ("id", "user_id", "title", "description", "location", "required_years_experience", "vehicle_required", "position_type", "salary_min", "salary_max", "status", "created_at", "updated_at", "flexible_on_title", "company_name", "job_location_type", "city", "zip_code", "job_type", "pay_range_min", "pay_range_max", "pay_type", "expected_hours", "work_schedule", "benefits", "key_responsibilities", "qualifications_years", "qualifications_certifications", "qualifications_other", "education_requirements", "other_relevant_titles", "advancement_opportunities", "advancement_timeline", "company_culture", "ai_generated_description") VALUES (12, 1, 'Lead HVAC Technician', NULL, NULL, 7, 0, 'Lead HVAC Technician', NULL, NULL, 'open', '2025-12-06 02:30:50', '2025-12-06 02:30:50', 1, NULL, NULL, NULL, NULL, NULL, NULL, NULL, NULL, NULL, NULL, NULL, NULL, NULL, NULL, NULL, NULL, NULL, 0, NULL, NULL, NULL) ON CONFLICT DO NOTHING;
INSERT INTO "jobs" ("id", "user_id", "title", "description", "location", "required_years_experience", "vehicle_required", "position_type", "salary_min", "salary_max", "status", "created_at", "updated_at", "flexible_on_title", "company_name", "job_location_type", "city", "zip_code", "job_type", "pay_range_min", "pay_range_max", "pay_type", "expected_hours", "work_schedule", "benefits", "key_responsibilities", "qualifications_years", "qualifications_certifications", "qualifications_other", "education_requirements", "other_relevant_titles", "advancement_opportunities", "advancement_timeline", "company_culture", "ai_generated_description") VALUES (13, 1, 'HVAC Dispatcher', NULL, NULL, 3, 0, 'HVAC Dispatcher', NULL, NULL, 'open', '2025-12-06 02:30:50', '2025-12-06 02:30:50', 1, NULL, NULL, NULL, NULL, NULL, NULL, NULL, NULL, NULL, NULL, NULL, NULL, NULL, NULL, NULL, NULL, NULL, 0, NULL, NULL, NULL) ON CONFLICT DO NOTHING;
INSERT INTO "jobs" ("id", "user_id", "title", "description", "location", "required_years_experience", "vehicle_required", "position_type", "salary_min", "salary_max", "status", "created_at", "updated_at", "flexible_on_title", "company_name", "job_location_type", "city", "zip_code", "job_type", "pay_range_min", "pay_range_max", "pay_type", "expected_hours", "work_schedule", "benefits", "key_responsibilities", "qualifications_years", "qualifications_certifications", "qualifications_other", "education_requirements", "other_relevant_titles", "advancement_opportunities", "advancement_timeline", "company_culture", "ai_generated_description") VALUES (14, 1, 'HVAC Sales Representative', NULL, NULL, 3, 0, 'HVAC Sales Representative', NULL, NULL, 'open', '2025-12-06 02:30:50', '2025-12-06 02:30:50', 1, NULL, NULL, NULL, NULL, NULL, NULL, NULL, NULL, NULL, NULL, NULL, NULL, NULL, NULL, NULL, NULL, NULL, 0, NULL, NULL, NULL) ON CONFLICT DO NOTHING;
INSERT INTO "jobs" ("id", "user_id", "title", "description", "location", "required_years_experience", "vehicle_required", "position_type", "salary_min", "salary_max", "status", "created_at", "updated_at", "flexible_on_title", "company_name", "job_location_type", "city", "zip_code", "job_type", "pay_range_min", "pay_range_max", "pay_type", "expected_hours", "work_schedule", "benefits", "key_responsibilities", "qualifications_years", "qualifications_certifications", "qualifications_other", "education_requirements", "other_relevant_titles", "advancement_opportunities", "advancement_timeline", "company_culture", "ai_generated_description") VALUES (15, 1, 'Bookkeeper', NULL, NULL, 3, 0, 'Bookkeeper', NULL, NULL, 'open', '2025-12-06 02:30:50', '2025-12-06 02:30:50', 1, NULL, NULL, NULL, NULL, NULL, NULL, NULL, NULL, NULL, NULL, NULL, NULL, NULL, NULL, NULL, NULL, NULL, 0, NULL, NULL, NULL) ON CONFLICT DO NOTHING;
INSERT INTO "jobs" ("id", "user_id", "title", "description", "location", "required_years_experience", "vehicle_required", "position_type", "salary_min", "salary_max", "status", "created_at", "updated_at", "flexible_on_title", "company_name", "job_location_type", "city", "zip_code", "job_type", "pay_range_min", "pay_range_max", "pay_type", "expected_hours", "work_schedule", "benefits", "key_responsibilities", "qualifications_years", "qualifications_certifications", "qualifications_other", "education_requirements", "other_relevant_titles", "advancement_opportunities", "advancement_timeline", "company_culture", "ai_generated_description") VALUES (16, 1, 'Administrative Assistant', NULL, NULL, 3, 0, 'Administrative Assistant', NULL, NULL, 'open', '2025-12-06 02:30:50', '2025-12-06 02:30:50', 1, NULL, NULL, NULL, NULL, NULL, NULL, NULL, NULL, NULL, NULL, NULL, NULL, NULL, NULL, NULL, NULL, NULL, 0, NULL, NULL, NULL) ON CONFLICT DO NOTHING;
INSERT INTO "jobs" ("id", "user_id", "title", "description", "location", "required_years_experience", "vehicle_required", "position_type", "salary_min", "salary_max", "status", "created_at", "updated_at", "flexible_on_title", "company_name", "job_location_type", "city", "zip_code", "job_type", "pay_range_min", "pay_range_max", "pay_type", "expected_hours", "work_schedule", "benefits", "key_responsibilities", "qualifications_years", "qualifications_certifications", "qualifications_other", "education_requirements", "other_relevant_titles", "advancement_opportunities", "advancement_timeline", "company_culture", "ai_generated_description") VALUES (17, 1, 'Customer Service Representative', NULL, NULL, 2, 0, 'Customer Service Representative', NULL, NULL, 'open', '2025-12-06 02:30:50', '2025-12-06 02:30:50', 1, NULL, NULL, NULL, NULL, NULL, NULL, NULL, NULL, NULL, NULL, NULL, NULL, NULL, NULL, NULL, NULL, NULL, 0, NULL, NULL, NULL) ON CONFLICT DO NOTHING;
INSERT INTO "jobs" ("id", "user_id", "title", "description", "location", "required_years_experience", "vehicle_required", "position_type", "salary_min", "salary_max", "status", "created_at", "updated_at", "flexible_on_title", "company_name", "job_location_type", "city", "zip_code", "job_type", "pay_range_min", "pay_range_max", "pay_type", "expected_hours", "work_schedule", "benefits", "key_responsibilities", "qualifications_years", "qualifications_certifications", "qualifications_other", "education_requirements", "other_relevant_titles", "advancement_opportunities", "advancement_timeline", "company_culture", "ai_generated_description") VALUES (18, 1, 'HVAC Apprentice', NULL, NULL, 0, 0, 'HVAC Apprentice', NULL, NULL, 'open', '2025-12-06 02:30:50', '2025-12-06 02:30:50', 1, NULL, NULL, NULL, NULL, NULL, NULL, NULL, NULL, NULL, NULL, NULL, NULL, NULL, NULL, NULL, NULL, NULL, 0, NULL, NULL, NULL) ON CONFLICT DO NOTHING;
INSERT INTO "jobs" ("id", "user_id", "title", "description", "location", "required_years_experience", "vehicle_required", "position_type", "salary_min", "salary_max", "status", "created_at", "updated_at", "flexible_on_title", "company_name", "job_location_type", "city", "zip_code", "job_type", "pay_range_min", "pay_range_max", "pay_type", "expected_hours", "work_schedule", "benefits", "key_responsibilities", "qualifications_years", "qualifications_certifications", "qualifications_other", "education_requirements", "other_relevant_titles", "advancement_opportunities", "advancement_timeline", "company_culture", "ai_generated_description") VALUES (19, 1, 'General Talent Pool', 'Default talent pool for all uploaded resumes', 'All Locations', 0, 0, 'General', NULL, NULL, 'active', '2025-12-15 23:50:31', '2025-12-15 23:50:31', 1, NULL, NULL, NULL, NULL, NULL, NULL, NULL, NULL, NULL, NULL, NULL, NULL, NULL, NULL, NULL, NULL, NULL, 0, NULL, NULL, NULL) ON CONFLICT DO NOTHING;
INSERT INTO "jobs" ("id", "user_id", "title", "description", "location", "required_years_experience", "vehicle_required", "position_type", "salary_min", "salary_max", "status", "created_at", "updated_at", "flexible_on_title", "company_name", "job_location_type", "city", "zip_code", "job_type", "pay_range_min", "pay_range_max", "pay_type", "expected_hours", "work_schedule", "benefits", "key_responsibilities", "qualifications_years", "qualifications_certifications", "qualifications_other", "education_requirements", "other_relevant_titles", "advancement_opportunities", "advancement_timeline", "company_culture", "ai_generated_description") VALUES (20, 1, 'HVAC Service technician', 'â•â•â•â•â•â•â•â•â•â•â•â•â•â•â•â•â•â•â•â•â•â•â•â•â•â•â•â•â•â•â•â•â•â•â•â•â•â•â•â•â•â•â•â•â•â•â•â•â•â•â•â•â•â•â•â•â•â•â•â•â•â•â•â•â•â•â•
ğŸ’° COMPENSATION
â•â•â•â•â•â•â•â•â•â•â•â•â•â•â•â•â•â•â•â•â•â•â•â•â•â•â•â•â•â•â•â•â•â•â•â•â•â•â•â•â•â•â•â•â•â•â•â•â•â•â•â•â•â•â•â•â•â•â•â•â•â•â•â•â•â•â•
Pay: $18 - $32 per hour
Schedule: Monday-Friday, 9AM-5PM
Job Type: Full-time (40 hours per week)

â•â•â•â•â•â•â•â•â•â•â•â•â•â•â•â•â•â•â•â•â•â•â•â•â•â•â•â•â•â•â•â•â•â•â•â•â•â•â•â•â•â•â•â•â•â•â•â•â•â•â•â•â•â•â•â•â•â•â•â•â•â•â•â•â•â•â•
ğŸ“‹ POSITION OVERVIEW
â•â•â•â•â•â•â•â•â•â•â•â•â•â•â•â•â•â•â•â•â•â•â•â•â•â•â•â•â•â•â•â•â•â•â•â•â•â•â•â•â•â•â•â•â•â•â•â•â•â•â•â•â•â•â•â•â•â•â•â•â•â•â•â•â•â•â•
Talos is seeking a skilled HVAC Service Technician to join our growing team in Austin. This is your opportunity to leverage your technical expertise while enjoying a consistent Monday-Friday schedule with no on-call rotations. You''ll work on diverse residential and commercial systems, from routine maintenance to complex repairs and installations, all while building lasting relationships with our valued customers. If you''re ready to advance your HVAC career with a company that values quality workmanship and work-life balance, we want to hear from you.

â•â•â•â•â•â•â•â•â•â•â•â•â•â•â•â•â•â•â•â•â•â•â•â•â•â•â•â•â•â•â•â•â•â•â•â•â•â•â•â•â•â•â•â•â•â•â•â•â•â•â•â•â•â•â•â•â•â•â•â•â•â•â•â•â•â•â•
ğŸ”§ WHAT YOU''LL DO
â•â•â•â•â•â•â•â•â•â•â•â•â•â•â•â•â•â•â•â•â•â•â•â•â•â•â•â•â•â•â•â•â•â•â•â•â•â•â•â•â•â•â•â•â•â•â•â•â•â•â•â•â•â•â•â•â•â•â•â•â•â•â•â•â•â•â•
â€¢ Perform comprehensive preventive maintenance on residential and commercial HVAC systems to ensure optimal performance and longevity
â€¢ Diagnose and troubleshoot heating, cooling, and ventilation system failures using advanced diagnostic tools and technical expertise
â€¢ Execute complete HVAC installations including ductwork, refrigerant lines, electrical connections, and system startup procedures
â€¢ Repair and replace defective components such as compressors, motors, thermostats, and refrigerant leaks following manufacturer specifications
â€¢ Conduct thorough system inspections and provide customers with clear explanations of findings and repair recommendations
â€¢ Maintain accurate service records, work orders, and equipment documentation using company systems
â€¢ Ensure compliance with all safety protocols, EPA regulations, and local building codes on every job site
â€¢ Communicate professionally with customers to deliver exceptional service and build long-term trust

â•â•â•â•â•â•â•â•â•â•â•â•â•â•â•â•â•â•â•â•â•â•â•â•â•â•â•â•â•â•â•â•â•â•â•â•â•â•â•â•â•â•â•â•â•â•â•â•â•â•â•â•â•â•â•â•â•â•â•â•â•â•â•â•â•â•â•
âœ… BASIC QUALIFICATIONS
â•â•â•â•â•â•â•â•â•â•â•â•â•â•â•â•â•â•â•â•â•â•â•â•â•â•â•â•â•â•â•â•â•â•â•â•â•â•â•â•â•â•â•â•â•â•â•â•â•â•â•â•â•â•â•â•â•â•â•â•â•â•â•â•â•â•â•
â€¢ Minimum 2 years of hands-on HVAC service, repair, and installation experience
â€¢ EPA 608 Type I certification (Small Appliances) required
â€¢ Technical school diploma or equivalent HVAC training program completion
â€¢ Valid driver''s license with clean driving record
â€¢ Proficiency with HVAC diagnostic tools, gauges, and testing equipment
â€¢ Ability to lift up to 75 lbs and work in attics, crawl spaces, and on rooftops in varying weather conditions

â•â•â•â•â•â•â•â•â•â•â•â•â•â•â•â•â•â•â•â•â•â•â•â•â•â•â•â•â•â•â•â•â•â•â•â•â•â•â•â•â•â•â•â•â•â•â•â•â•â•â•â•â•â•â•â•â•â•â•â•â•â•â•â•â•â•â•
â­ PREFERRED QUALIFICATIONS
â•â•â•â•â•â•â•â•â•â•â•â•â•â•â•â•â•â•â•â•â•â•â•â•â•â•â•â•â•â•â•â•â•â•â•â•â•â•â•â•â•â•â•â•â•â•â•â•â•â•â•â•â•â•â•â•â•â•â•â•â•â•â•â•â•â•â•
â€¢ EPA 608 Universal certification or higher certification levels
â€¢ Experience with residential and light commercial split systems, package units, and heat pumps
â€¢ NATE certification in Service or Installation
â€¢ Strong customer service skills with ability to explain technical issues to non-technical customers
â€¢ Familiarity with smart thermostats and building automation controls

â•â•â•â•â•â•â•â•â•â•â•â•â•â•â•â•â•â•â•â•â•â•â•â•â•â•â•â•â•â•â•â•â•â•â•â•â•â•â•â•â•â•â•â•â•â•â•â•â•â•â•â•â•â•â•â•â•â•â•â•â•â•â•â•â•â•â•
ğŸ’¼ WHY YOU''LL LOVE WORKING HERE
â•â•â•â•â•â•â•â•â•â•â•â•â•â•â•â•â•â•â•â•â•â•â•â•â•â•â•â•â•â•â•â•â•â•â•â•â•â•â•â•â•â•â•â•â•â•â•â•â•â•â•â•â•â•â•â•â•â•â•â•â•â•â•â•â•â•â•
At Talos, we invest in our technicians'' success and well-being. You''ll enjoy a true work-life balance with consistent daytime hours and weekends offâ€”no emergency on-call disrupting your personal time. We provide the tools, training, and support you need to excel in your craft while growing your career in the thriving Austin market.

Our benefits include:
â€¢ Comprehensive health insurance coverage
â€¢ Dental insurance
â€¢ Vision insurance
â€¢ Life insurance
â€¢ Paid time off for rest and recharge

â•â•â•â•â•â•â•â•â•â•â•â•â•â•â•â•â•â•â•â•â•â•â•â•â•â•â•â•â•â•â•â•â•â•â•â•â•â•â•â•â•â•â•â•â•â•â•â•â•â•â•â•â•â•â•â•â•â•â•â•â•â•â•â•â•â•â•
ğŸ“ WORK LOCATION
â•â•â•â•â•â•â•â•â•â•â•â•â•â•â•â•â•â•â•â•â•â•â•â•â•â•â•â•â•â•â•â•â•â•â•â•â•â•â•â•â•â•â•â•â•â•â•â•â•â•â•â•â•â•â•â•â•â•â•â•â•â•â•â•â•â•â•
Location: Austin, 78752 - In person

â•â•â•â•â•â•â•â•â•â•â•â•â•â•â•â•â•â•â•â•â•â•â•â•â•â•â•â•â•â•â•â•â•â•â•â•â•â•â•â•â•â•â•â•â•â•â•â•â•â•â•â•â•â•â•â•â•â•â•â•â•â•â•â•â•â•â•', 'Austin, 78752', 2, 0, 'HVAC Service technician', NULL, NULL, 'active', '2026-01-03 04:46:21', '2026-01-03 04:46:21', 1, 'Talos', 'on-site', 'Austin', '78752', 'full_time', 18, 32, 'hourly', '40', 'Monday-Friday 9AM-5PM', '["Health insurance","Dental insurance","Life insurance","Paid time off","Vision insurance"]', '["HVAC Maintenance","HVAC Installation","HVAC repairs"]', 2, '["EPA 608 Type I (Small Appliances)"]', NULL, 'technical_school', '[]', 0, '', '', 'â•â•â•â•â•â•â•â•â•â•â•â•â•â•â•â•â•â•â•â•â•â•â•â•â•â•â•â•â•â•â•â•â•â•â•â•â•â•â•â•â•â•â•â•â•â•â•â•â•â•â•â•â•â•â•â•â•â•â•â•â•â•â•â•â•â•â•
ğŸ’° COMPENSATION
â•â•â•â•â•â•â•â•â•â•â•â•â•â•â•â•â•â•â•â•â•â•â•â•â•â•â•â•â•â•â•â•â•â•â•â•â•â•â•â•â•â•â•â•â•â•â•â•â•â•â•â•â•â•â•â•â•â•â•â•â•â•â•â•â•â•â•
Pay: $18 - $32 per hour
Schedule: Monday-Friday, 9AM-5PM
Job Type: Full-time (40 hours per week)

â•â•â•â•â•â•â•â•â•â•â•â•â•â•â•â•â•â•â•â•â•â•â•â•â•â•â•â•â•â•â•â•â•â•â•â•â•â•â•â•â•â•â•â•â•â•â•â•â•â•â•â•â•â•â•â•â•â•â•â•â•â•â•â•â•â•â•
ğŸ“‹ POSITION OVERVIEW
â•â•â•â•â•â•â•â•â•â•â•â•â•â•â•â•â•â•â•â•â•â•â•â•â•â•â•â•â•â•â•â•â•â•â•â•â•â•â•â•â•â•â•â•â•â•â•â•â•â•â•â•â•â•â•â•â•â•â•â•â•â•â•â•â•â•â•
Talos is seeking a skilled HVAC Service Technician to join our growing team in Austin. This is your opportunity to leverage your technical expertise while enjoying a consistent Monday-Friday schedule with no on-call rotations. You''ll work on diverse residential and commercial systems, from routine maintenance to complex repairs and installations, all while building lasting relationships with our valued customers. If you''re ready to advance your HVAC career with a company that values quality workmanship and work-life balance, we want to hear from you.

â•â•â•â•â•â•â•â•â•â•â•â•â•â•â•â•â•â•â•â•â•â•â•â•â•â•â•â•â•â•â•â•â•â•â•â•â•â•â•â•â•â•â•â•â•â•â•â•â•â•â•â•â•â•â•â•â•â•â•â•â•â•â•â•â•â•â•
ğŸ”§ WHAT YOU''LL DO
â•â•â•â•â•â•â•â•â•â•â•â•â•â•â•â•â•â•â•â•â•â•â•â•â•â•â•â•â•â•â•â•â•â•â•â•â•â•â•â•â•â•â•â•â•â•â•â•â•â•â•â•â•â•â•â•â•â•â•â•â•â•â•â•â•â•â•
â€¢ Perform comprehensive preventive maintenance on residential and commercial HVAC systems to ensure optimal performance and longevity
â€¢ Diagnose and troubleshoot heating, cooling, and ventilation system failures using advanced diagnostic tools and technical expertise
â€¢ Execute complete HVAC installations including ductwork, refrigerant lines, electrical connections, and system startup procedures
â€¢ Repair and replace defective components such as compressors, motors, thermostats, and refrigerant leaks following manufacturer specifications
â€¢ Conduct thorough system inspections and provide customers with clear explanations of findings and repair recommendations
â€¢ Maintain accurate service records, work orders, and equipment documentation using company systems
â€¢ Ensure compliance with all safety protocols, EPA regulations, and local building codes on every job site
â€¢ Communicate professionally with customers to deliver exceptional service and build long-term trust

â•â•â•â•â•â•â•â•â•â•â•â•â•â•â•â•â•â•â•â•â•â•â•â•â•â•â•â•â•â•â•â•â•â•â•â•â•â•â•â•â•â•â•â•â•â•â•â•â•â•â•â•â•â•â•â•â•â•â•â•â•â•â•â•â•â•â•
âœ… BASIC QUALIFICATIONS
â•â•â•â•â•â•â•â•â•â•â•â•â•â•â•â•â•â•â•â•â•â•â•â•â•â•â•â•â•â•â•â•â•â•â•â•â•â•â•â•â•â•â•â•â•â•â•â•â•â•â•â•â•â•â•â•â•â•â•â•â•â•â•â•â•â•â•
â€¢ Minimum 2 years of hands-on HVAC service, repair, and installation experience
â€¢ EPA 608 Type I certification (Small Appliances) required
â€¢ Technical school diploma or equivalent HVAC training program completion
â€¢ Valid driver''s license with clean driving record
â€¢ Proficiency with HVAC diagnostic tools, gauges, and testing equipment
â€¢ Ability to lift up to 75 lbs and work in attics, crawl spaces, and on rooftops in varying weather conditions

â•â•â•â•â•â•â•â•â•â•â•â•â•â•â•â•â•â•â•â•â•â•â•â•â•â•â•â•â•â•â•â•â•â•â•â•â•â•â•â•â•â•â•â•â•â•â•â•â•â•â•â•â•â•â•â•â•â•â•â•â•â•â•â•â•â•â•
â­ PREFERRED QUALIFICATIONS
â•â•â•â•â•â•â•â•â•â•â•â•â•â•â•â•â•â•â•â•â•â•â•â•â•â•â•â•â•â•â•â•â•â•â•â•â•â•â•â•â•â•â•â•â•â•â•â•â•â•â•â•â•â•â•â•â•â•â•â•â•â•â•â•â•â•â•
â€¢ EPA 608 Universal certification or higher certification levels
â€¢ Experience with residential and light commercial split systems, package units, and heat pumps
â€¢ NATE certification in Service or Installation
â€¢ Strong customer service skills with ability to explain technical issues to non-technical customers
â€¢ Familiarity with smart thermostats and building automation controls

â•â•â•â•â•â•â•â•â•â•â•â•â•â•â•â•â•â•â•â•â•â•â•â•â•â•â•â•â•â•â•â•â•â•â•â•â•â•â•â•â•â•â•â•â•â•â•â•â•â•â•â•â•â•â•â•â•â•â•â•â•â•â•â•â•â•â•
ğŸ’¼ WHY YOU''LL LOVE WORKING HERE
â•â•â•â•â•â•â•â•â•â•â•â•â•â•â•â•â•â•â•â•â•â•â•â•â•â•â•â•â•â•â•â•â•â•â•â•â•â•â•â•â•â•â•â•â•â•â•â•â•â•â•â•â•â•â•â•â•â•â•â•â•â•â•â•â•â•â•
At Talos, we invest in our technicians'' success and well-being. You''ll enjoy a true work-life balance with consistent daytime hours and weekends offâ€”no emergency on-call disrupting your personal time. We provide the tools, training, and support you need to excel in your craft while growing your career in the thriving Austin market.

Our benefits include:
â€¢ Comprehensive health insurance coverage
â€¢ Dental insurance
â€¢ Vision insurance
â€¢ Life insurance
â€¢ Paid time off for rest and recharge

â•â•â•â•â•â•â•â•â•â•â•â•â•â•â•â•â•â•â•â•â•â•â•â•â•â•â•â•â•â•â•â•â•â•â•â•â•â•â•â•â•â•â•â•â•â•â•â•â•â•â•â•â•â•â•â•â•â•â•â•â•â•â•â•â•â•â•
ğŸ“ WORK LOCATION
â•â•â•â•â•â•â•â•â•â•â•â•â•â•â•â•â•â•â•â•â•â•â•â•â•â•â•â•â•â•â•â•â•â•â•â•â•â•â•â•â•â•â•â•â•â•â•â•â•â•â•â•â•â•â•â•â•â•â•â•â•â•â•â•â•â•â•
Location: Austin, 78752 - In person

â•â•â•â•â•â•â•â•â•â•â•â•â•â•â•â•â•â•â•â•â•â•â•â•â•â•â•â•â•â•â•â•â•â•â•â•â•â•â•â•â•â•â•â•â•â•â•â•â•â•â•â•â•â•â•â•â•â•â•â•â•â•â•â•â•â•â•') ON CONFLICT DO NOTHING;
INSERT INTO "jobs" ("id", "user_id", "title", "description", "location", "required_years_experience", "vehicle_required", "position_type", "salary_min", "salary_max", "status", "created_at", "updated_at", "flexible_on_title", "company_name", "job_location_type", "city", "zip_code", "job_type", "pay_range_min", "pay_range_max", "pay_type", "expected_hours", "work_schedule", "benefits", "key_responsibilities", "qualifications_years", "qualifications_certifications", "qualifications_other", "education_requirements", "other_relevant_titles", "advancement_opportunities", "advancement_timeline", "company_culture", "ai_generated_description") VALUES (21, 1, 'Maintenance Technician', 'â•â•â•â•â•â•â•â•â•â•â•â•â•â•â•â•â•â•â•â•â•â•â•â•â•â•â•â•â•â•â•â•â•â•â•â•â•â•â•â•â•â•â•â•â•â•â•â•â•â•â•â•â•â•â•â•â•â•â•â•â•â•â•â•â•â•â•
ğŸ’° COMPENSATION
â•â•â•â•â•â•â•â•â•â•â•â•â•â•â•â•â•â•â•â•â•â•â•â•â•â•â•â•â•â•â•â•â•â•â•â•â•â•â•â•â•â•â•â•â•â•â•â•â•â•â•â•â•â•â•â•â•â•â•â•â•â•â•â•â•â•â•
Pay: $18 - $32 per hour
Schedule: Monday-Friday, 9:00 AM - 5:00 PM
Job Type: Full-time (40 hours/week)

â•â•â•â•â•â•â•â•â•â•â•â•â•â•â•â•â•â•â•â•â•â•â•â•â•â•â•â•â•â•â•â•â•â•â•â•â•â•â•â•â•â•â•â•â•â•â•â•â•â•â•â•â•â•â•â•â•â•â•â•â•â•â•â•â•â•â•
ğŸ“‹ POSITION OVERVIEW
â•â•â•â•â•â•â•â•â•â•â•â•â•â•â•â•â•â•â•â•â•â•â•â•â•â•â•â•â•â•â•â•â•â•â•â•â•â•â•â•â•â•â•â•â•â•â•â•â•â•â•â•â•â•â•â•â•â•â•â•â•â•â•â•â•â•â•
Perry''s Heating and Air is seeking a skilled Maintenance Technician to join our growing team in Austin. This is your opportunity to build a rewarding career with a company that values quality workmanship and customer satisfaction. You''ll work on diverse HVAC systems across residential and commercial properties, developing your expertise while enjoying stable daytime hours and excellent benefits. If you''re ready to take your HVAC skills to the next level with a company that invests in your success, we want to hear from you.

â•â•â•â•â•â•â•â•â•â•â•â•â•â•â•â•â•â•â•â•â•â•â•â•â•â•â•â•â•â•â•â•â•â•â•â•â•â•â•â•â•â•â•â•â•â•â•â•â•â•â•â•â•â•â•â•â•â•â•â•â•â•â•â•â•â•â•
ğŸ”§ WHAT YOU''LL DO
â•â•â•â•â•â•â•â•â•â•â•â•â•â•â•â•â•â•â•â•â•â•â•â•â•â•â•â•â•â•â•â•â•â•â•â•â•â•â•â•â•â•â•â•â•â•â•â•â•â•â•â•â•â•â•â•â•â•â•â•â•â•â•â•â•â•â•
â€¢ Perform preventive maintenance on residential and commercial HVAC systems including cleaning, inspections, and tune-ups
â€¢ Install complete HVAC systems, including ductwork, thermostats, air handlers, and condensing units
â€¢ Diagnose and repair heating and cooling equipment malfunctions using testing instruments and hand tools
â€¢ Conduct system performance tests and adjust components to ensure optimal efficiency and comfort
â€¢ Communicate with customers professionally, explaining service needs and answering technical questions
â€¢ Maintain accurate service records, work orders, and equipment documentation
â€¢ Follow all safety protocols and comply with local codes and manufacturer specifications
â€¢ Respond to service calls efficiently while maintaining high-quality workmanship standards

â•â•â•â•â•â•â•â•â•â•â•â•â•â•â•â•â•â•â•â•â•â•â•â•â•â•â•â•â•â•â•â•â•â•â•â•â•â•â•â•â•â•â•â•â•â•â•â•â•â•â•â•â•â•â•â•â•â•â•â•â•â•â•â•â•â•â•
âœ… BASIC QUALIFICATIONS
â•â•â•â•â•â•â•â•â•â•â•â•â•â•â•â•â•â•â•â•â•â•â•â•â•â•â•â•â•â•â•â•â•â•â•â•â•â•â•â•â•â•â•â•â•â•â•â•â•â•â•â•â•â•â•â•â•â•â•â•â•â•â•â•â•â•â•
â€¢ Minimum 2 years of hands-on HVAC maintenance, installation, and repair experience
â€¢ Strong working knowledge of residential and commercial heating and cooling systems
â€¢ Ability to read and interpret technical manuals, blueprints, and wiring diagrams
â€¢ Valid driver''s license with clean driving record
â€¢ Physical ability to lift up to 75 lbs, work in confined spaces, and climb ladders
â€¢ Reliable transportation to job sites throughout the Austin area

â•â•â•â•â•â•â•â•â•â•â•â•â•â•â•â•â•â•â•â•â•â•â•â•â•â•â•â•â•â•â•â•â•â•â•â•â•â•â•â•â•â•â•â•â•â•â•â•â•â•â•â•â•â•â•â•â•â•â•â•â•â•â•â•â•â•â•
â­ PREFERRED QUALIFICATIONS
â•â•â•â•â•â•â•â•â•â•â•â•â•â•â•â•â•â•â•â•â•â•â•â•â•â•â•â•â•â•â•â•â•â•â•â•â•â•â•â•â•â•â•â•â•â•â•â•â•â•â•â•â•â•â•â•â•â•â•â•â•â•â•â•â•â•â•
â€¢ EPA Section 608 Universal Certification for refrigerant handling
â€¢ Experience with modern HVAC controls, smart thermostats, and variable-speed systems
â€¢ Background in both residential and light commercial applications
â€¢ Strong customer service skills with ability to build client relationships
â€¢ Willingness to pursue ongoing training and professional development

â•â•â•â•â•â•â•â•â•â•â•â•â•â•â•â•â•â•â•â•â•â•â•â•â•â•â•â•â•â•â•â•â•â•â•â•â•â•â•â•â•â•â•â•â•â•â•â•â•â•â•â•â•â•â•â•â•â•â•â•â•â•â•â•â•â•â•
ğŸ’¼ WHY YOU''LL LOVE WORKING HERE
â•â•â•â•â•â•â•â•â•â•â•â•â•â•â•â•â•â•â•â•â•â•â•â•â•â•â•â•â•â•â•â•â•â•â•â•â•â•â•â•â•â•â•â•â•â•â•â•â•â•â•â•â•â•â•â•â•â•â•â•â•â•â•â•â•â•â•
At Perry''s Heating and Air, we''re committed to supporting our technicians with the tools, training, and respect they deserve. We offer clear advancement opportunities for those who demonstrate excellence and dedication to their craft. Enjoy predictable daytime hours that support work-life balance while building a stable, long-term career in Austin''s thriving HVAC industry.

Our benefits include:
â€¢ Comprehensive health insurance coverage
â€¢ Dental and vision insurance
â€¢ Company-paid life insurance
â€¢ 401(k) retirement plan with 2% company match
â€¢ Paid time off for vacation and holidays
â€¢ Advancement opportunities with clear career paths

â•â•â•â•â•â•â•â•â•â•â•â•â•â•â•â•â•â•â•â•â•â•â•â•â•â•â•â•â•â•â•â•â•â•â•â•â•â•â•â•â•â•â•â•â•â•â•â•â•â•â•â•â•â•â•â•â•â•â•â•â•â•â•â•â•â•â•
ğŸ“ WORK LOCATION
â•â•â•â•â•â•â•â•â•â•â•â•â•â•â•â•â•â•â•â•â•â•â•â•â•â•â•â•â•â•â•â•â•â•â•â•â•â•â•â•â•â•â•â•â•â•â•â•â•â•â•â•â•â•â•â•â•â•â•â•â•â•â•â•â•â•â•
Location: Austin, TX 78752 - In person

â•â•â•â•â•â•â•â•â•â•â•â•â•â•â•â•â•â•â•â•â•â•â•â•â•â•â•â•â•â•â•â•â•â•â•â•â•â•â•â•â•â•â•â•â•â•â•â•â•â•â•â•â•â•â•â•â•â•â•â•â•â•â•â•â•â•â•', 'Austin, 78752', 2, 0, 'Maintenance Technician', NULL, NULL, 'active', '2026-01-03 04:54:59', '2026-01-03 04:54:59', 1, 'Perry''s Heating and Air', 'on-site', 'Austin', '78752', 'full_time', 18, 32, 'hourly', '40', 'Monday-Friday 9AM-5PM', '["Health insurance","Dental insurance","Life insurance","401(k) 2% match","Vision insurance","Paid time off"]', '["HVAC Maintenance","HVAC Installation","HVAC repairs"]', 2, '[]', NULL, 'no_degree', '[]', 1, '', '', 'â•â•â•â•â•â•â•â•â•â•â•â•â•â•â•â•â•â•â•â•â•â•â•â•â•â•â•â•â•â•â•â•â•â•â•â•â•â•â•â•â•â•â•â•â•â•â•â•â•â•â•â•â•â•â•â•â•â•â•â•â•â•â•â•â•â•â•
ğŸ’° COMPENSATION
â•â•â•â•â•â•â•â•â•â•â•â•â•â•â•â•â•â•â•â•â•â•â•â•â•â•â•â•â•â•â•â•â•â•â•â•â•â•â•â•â•â•â•â•â•â•â•â•â•â•â•â•â•â•â•â•â•â•â•â•â•â•â•â•â•â•â•
Pay: $18 - $32 per hour
Schedule: Monday-Friday, 9:00 AM - 5:00 PM
Job Type: Full-time (40 hours/week)

â•â•â•â•â•â•â•â•â•â•â•â•â•â•â•â•â•â•â•â•â•â•â•â•â•â•â•â•â•â•â•â•â•â•â•â•â•â•â•â•â•â•â•â•â•â•â•â•â•â•â•â•â•â•â•â•â•â•â•â•â•â•â•â•â•â•â•
ğŸ“‹ POSITION OVERVIEW
â•â•â•â•â•â•â•â•â•â•â•â•â•â•â•â•â•â•â•â•â•â•â•â•â•â•â•â•â•â•â•â•â•â•â•â•â•â•â•â•â•â•â•â•â•â•â•â•â•â•â•â•â•â•â•â•â•â•â•â•â•â•â•â•â•â•â•
Perry''s Heating and Air is seeking a skilled Maintenance Technician to join our growing team in Austin. This is your opportunity to build a rewarding career with a company that values quality workmanship and customer satisfaction. You''ll work on diverse HVAC systems across residential and commercial properties, developing your expertise while enjoying stable daytime hours and excellent benefits. If you''re ready to take your HVAC skills to the next level with a company that invests in your success, we want to hear from you.

â•â•â•â•â•â•â•â•â•â•â•â•â•â•â•â•â•â•â•â•â•â•â•â•â•â•â•â•â•â•â•â•â•â•â•â•â•â•â•â•â•â•â•â•â•â•â•â•â•â•â•â•â•â•â•â•â•â•â•â•â•â•â•â•â•â•â•
ğŸ”§ WHAT YOU''LL DO
â•â•â•â•â•â•â•â•â•â•â•â•â•â•â•â•â•â•â•â•â•â•â•â•â•â•â•â•â•â•â•â•â•â•â•â•â•â•â•â•â•â•â•â•â•â•â•â•â•â•â•â•â•â•â•â•â•â•â•â•â•â•â•â•â•â•â•
â€¢ Perform preventive maintenance on residential and commercial HVAC systems including cleaning, inspections, and tune-ups
â€¢ Install complete HVAC systems, including ductwork, thermostats, air handlers, and condensing units
â€¢ Diagnose and repair heating and cooling equipment malfunctions using testing instruments and hand tools
â€¢ Conduct system performance tests and adjust components to ensure optimal efficiency and comfort
â€¢ Communicate with customers professionally, explaining service needs and answering technical questions
â€¢ Maintain accurate service records, work orders, and equipment documentation
â€¢ Follow all safety protocols and comply with local codes and manufacturer specifications
â€¢ Respond to service calls efficiently while maintaining high-quality workmanship standards

â•â•â•â•â•â•â•â•â•â•â•â•â•â•â•â•â•â•â•â•â•â•â•â•â•â•â•â•â•â•â•â•â•â•â•â•â•â•â•â•â•â•â•â•â•â•â•â•â•â•â•â•â•â•â•â•â•â•â•â•â•â•â•â•â•â•â•
âœ… BASIC QUALIFICATIONS
â•â•â•â•â•â•â•â•â•â•â•â•â•â•â•â•â•â•â•â•â•â•â•â•â•â•â•â•â•â•â•â•â•â•â•â•â•â•â•â•â•â•â•â•â•â•â•â•â•â•â•â•â•â•â•â•â•â•â•â•â•â•â•â•â•â•â•
â€¢ Minimum 2 years of hands-on HVAC maintenance, installation, and repair experience
â€¢ Strong working knowledge of residential and commercial heating and cooling systems
â€¢ Ability to read and interpret technical manuals, blueprints, and wiring diagrams
â€¢ Valid driver''s license with clean driving record
â€¢ Physical ability to lift up to 75 lbs, work in confined spaces, and climb ladders
â€¢ Reliable transportation to job sites throughout the Austin area

â•â•â•â•â•â•â•â•â•â•â•â•â•â•â•â•â•â•â•â•â•â•â•â•â•â•â•â•â•â•â•â•â•â•â•â•â•â•â•â•â•â•â•â•â•â•â•â•â•â•â•â•â•â•â•â•â•â•â•â•â•â•â•â•â•â•â•
â­ PREFERRED QUALIFICATIONS
â•â•â•â•â•â•â•â•â•â•â•â•â•â•â•â•â•â•â•â•â•â•â•â•â•â•â•â•â•â•â•â•â•â•â•â•â•â•â•â•â•â•â•â•â•â•â•â•â•â•â•â•â•â•â•â•â•â•â•â•â•â•â•â•â•â•â•
â€¢ EPA Section 608 Universal Certification for refrigerant handling
â€¢ Experience with modern HVAC controls, smart thermostats, and variable-speed systems
â€¢ Background in both residential and light commercial applications
â€¢ Strong customer service skills with ability to build client relationships
â€¢ Willingness to pursue ongoing training and professional development

â•â•â•â•â•â•â•â•â•â•â•â•â•â•â•â•â•â•â•â•â•â•â•â•â•â•â•â•â•â•â•â•â•â•â•â•â•â•â•â•â•â•â•â•â•â•â•â•â•â•â•â•â•â•â•â•â•â•â•â•â•â•â•â•â•â•â•
ğŸ’¼ WHY YOU''LL LOVE WORKING HERE
â•â•â•â•â•â•â•â•â•â•â•â•â•â•â•â•â•â•â•â•â•â•â•â•â•â•â•â•â•â•â•â•â•â•â•â•â•â•â•â•â•â•â•â•â•â•â•â•â•â•â•â•â•â•â•â•â•â•â•â•â•â•â•â•â•â•â•
At Perry''s Heating and Air, we''re committed to supporting our technicians with the tools, training, and respect they deserve. We offer clear advancement opportunities for those who demonstrate excellence and dedication to their craft. Enjoy predictable daytime hours that support work-life balance while building a stable, long-term career in Austin''s thriving HVAC industry.

Our benefits include:
â€¢ Comprehensive health insurance coverage
â€¢ Dental and vision insurance
â€¢ Company-paid life insurance
â€¢ 401(k) retirement plan with 2% company match
â€¢ Paid time off for vacation and holidays
â€¢ Advancement opportunities with clear career paths

â•â•â•â•â•â•â•â•â•â•â•â•â•â•â•â•â•â•â•â•â•â•â•â•â•â•â•â•â•â•â•â•â•â•â•â•â•â•â•â•â•â•â•â•â•â•â•â•â•â•â•â•â•â•â•â•â•â•â•â•â•â•â•â•â•â•â•
ğŸ“ WORK LOCATION
â•â•â•â•â•â•â•â•â•â•â•â•â•â•â•â•â•â•â•â•â•â•â•â•â•â•â•â•â•â•â•â•â•â•â•â•â•â•â•â•â•â•â•â•â•â•â•â•â•â•â•â•â•â•â•â•â•â•â•â•â•â•â•â•â•â•â•
Location: Austin, TX 78752 - In person

â•â•â•â•â•â•â•â•â•â•â•â•â•â•â•â•â•â•â•â•â•â•â•â•â•â•â•â•â•â•â•â•â•â•â•â•â•â•â•â•â•â•â•â•â•â•â•â•â•â•â•â•â•â•â•â•â•â•â•â•â•â•â•â•â•â•â•') ON CONFLICT DO NOTHING;

-- Data for candidates
INSERT INTO "candidates" ("id", "batch_id", "filename", "file_path", "upload_date", "status") VALUES (1, 1, 'exampleresume5.pdf', 'uploads\resume-1759611728914-297128002.pdf', '2025-10-04 21:02:08', 'completed') ON CONFLICT DO NOTHING;
INSERT INTO "candidates" ("id", "batch_id", "filename", "file_path", "upload_date", "status") VALUES (2, 1, 'exampleresume4.pdf', 'uploads\resume-1759611728916-405748551.pdf', '2025-10-04 21:02:25', 'completed') ON CONFLICT DO NOTHING;
INSERT INTO "candidates" ("id", "batch_id", "filename", "file_path", "upload_date", "status") VALUES (3, 1, 'exampleresume3.pdf', 'uploads\resume-1759611728916-48465270.pdf', '2025-10-04 21:02:43', 'completed') ON CONFLICT DO NOTHING;
INSERT INTO "candidates" ("id", "batch_id", "filename", "file_path", "upload_date", "status") VALUES (4, 1, 'Exampleresume2.pdf', 'uploads\resume-1759611728916-376512652.pdf', '2025-10-04 21:03:02', 'completed') ON CONFLICT DO NOTHING;
INSERT INTO "candidates" ("id", "batch_id", "filename", "file_path", "upload_date", "status") VALUES (5, 1, 'exampleresume1.pdf', 'uploads\resume-1759611728917-548356042.pdf', '2025-10-04 21:03:22', 'completed') ON CONFLICT DO NOTHING;
INSERT INTO "candidates" ("id", "batch_id", "filename", "file_path", "upload_date", "status") VALUES (6, 1, 'exampleresume.pdf', 'uploads\resume-1759611728917-796522636.pdf', '2025-10-04 21:03:43', 'completed') ON CONFLICT DO NOTHING;
INSERT INTO "candidates" ("id", "batch_id", "filename", "file_path", "upload_date", "status") VALUES (7, 2, 'exampleresume4.pdf', 'uploads\resume-1761002427485-517038971.pdf', '2025-10-20 23:20:27', 'completed') ON CONFLICT DO NOTHING;
INSERT INTO "candidates" ("id", "batch_id", "filename", "file_path", "upload_date", "status") VALUES (8, 3, 'ResumeRobertGrossenbacher.pdf', 'uploads\resume-1761422229950-367944985.pdf', '2025-10-25 19:57:09', 'completed') ON CONFLICT DO NOTHING;
INSERT INTO "candidates" ("id", "batch_id", "filename", "file_path", "upload_date", "status") VALUES (9, 3, 'ResumeJoseAlvarez.pdf', 'uploads\resume-1761422229952-520084557.pdf', '2025-10-25 19:57:30', 'completed') ON CONFLICT DO NOTHING;
INSERT INTO "candidates" ("id", "batch_id", "filename", "file_path", "upload_date", "status") VALUES (10, 4, 'ResumeRobertGrossenbacher.pdf', 'uploads\resume-1761426431886-34045010.pdf', '2025-10-25 21:07:11', 'completed') ON CONFLICT DO NOTHING;
INSERT INTO "candidates" ("id", "batch_id", "filename", "file_path", "upload_date", "status") VALUES (11, 5, 'Jamel Lindsay.pdf', 'uploads\resume-1762019526366-905928202.pdf', '2025-11-01 17:52:06', 'completed') ON CONFLICT DO NOTHING;
INSERT INTO "candidates" ("id", "batch_id", "filename", "file_path", "upload_date", "status") VALUES (12, 5, 'Ashok Kumar Wairawen.pdf', 'uploads\resume-1762019526367-156281959.pdf', '2025-11-01 17:52:28', 'completed') ON CONFLICT DO NOTHING;
INSERT INTO "candidates" ("id", "batch_id", "filename", "file_path", "upload_date", "status") VALUES (13, 5, 'Charles Ferguson.pdf', 'uploads\resume-1762019526370-670196222.pdf', '2025-11-01 17:52:48', 'completed') ON CONFLICT DO NOTHING;
INSERT INTO "candidates" ("id", "batch_id", "filename", "file_path", "upload_date", "status") VALUES (14, 5, 'Darren.pdf', 'uploads\resume-1762019526370-321115234.pdf', '2025-11-01 17:53:07', 'completed') ON CONFLICT DO NOTHING;
INSERT INTO "candidates" ("id", "batch_id", "filename", "file_path", "upload_date", "status") VALUES (15, 5, 'David Beam J.R.pdf', 'uploads\resume-1762019526374-449091976.pdf', '2025-11-01 17:53:27', 'completed') ON CONFLICT DO NOTHING;
INSERT INTO "candidates" ("id", "batch_id", "filename", "file_path", "upload_date", "status") VALUES (16, 6, 'A+ Service tech resume.pdf', 'uploads\resume-1762033070851-873624988.pdf', '2025-11-01 21:37:50', 'completed') ON CONFLICT DO NOTHING;
INSERT INTO "candidates" ("id", "batch_id", "filename", "file_path", "upload_date", "status") VALUES (17, 7, 'Charles Ferguson.pdf', 'uploads\resume-1762033644568-807448223.pdf', '2025-11-01 21:47:24', 'completed') ON CONFLICT DO NOTHING;
INSERT INTO "candidates" ("id", "batch_id", "filename", "file_path", "upload_date", "status") VALUES (18, 7, 'Darren.pdf', 'uploads\resume-1762033644569-28022445.pdf', '2025-11-01 21:47:43', 'completed') ON CONFLICT DO NOTHING;
INSERT INTO "candidates" ("id", "batch_id", "filename", "file_path", "upload_date", "status") VALUES (19, 7, 'David Beam J.R.pdf', 'uploads\resume-1762033644570-570182245.pdf', '2025-11-01 21:48:01', 'completed') ON CONFLICT DO NOTHING;
INSERT INTO "candidates" ("id", "batch_id", "filename", "file_path", "upload_date", "status") VALUES (20, 7, 'Jamel Lindsay.pdf', 'uploads\resume-1762033644571-57767581.pdf', '2025-11-01 21:48:21', 'completed') ON CONFLICT DO NOTHING;
INSERT INTO "candidates" ("id", "batch_id", "filename", "file_path", "upload_date", "status") VALUES (21, 7, 'Andrew Kincherlow.pdf', 'uploads\resume-1762033644571-376747608.pdf', '2025-11-01 21:48:39', 'completed') ON CONFLICT DO NOTHING;
INSERT INTO "candidates" ("id", "batch_id", "filename", "file_path", "upload_date", "status") VALUES (22, 8, 'A+ Service tech resume.pdf', 'uploads\resume-1762034180027-308275571.pdf', '2025-11-01 21:56:20', 'completed') ON CONFLICT DO NOTHING;
INSERT INTO "candidates" ("id", "batch_id", "filename", "file_path", "upload_date", "status") VALUES (23, 8, 'Jamel Lindsay.pdf', 'uploads\resume-1762034180028-759168273.pdf', '2025-11-01 21:56:38', 'completed') ON CONFLICT DO NOTHING;
INSERT INTO "candidates" ("id", "batch_id", "filename", "file_path", "upload_date", "status") VALUES (24, 9, 'Mickaelson Delva.pdf', 'uploads\resume-1762638762464-153239818.pdf', '2025-11-08 21:52:42', 'error') ON CONFLICT DO NOTHING;
INSERT INTO "candidates" ("id", "batch_id", "filename", "file_path", "upload_date", "status") VALUES (25, 10, 'Jonathon Dominguez.pdf', 'uploads\resume-1762638777595-674369697.pdf', '2025-11-08 21:52:57', 'error') ON CONFLICT DO NOTHING;
INSERT INTO "candidates" ("id", "batch_id", "filename", "file_path", "upload_date", "status") VALUES (26, 10, 'Michael Adams.pdf', 'uploads\resume-1762638777595-853213068.pdf', '2025-11-08 21:52:57', 'error') ON CONFLICT DO NOTHING;
INSERT INTO "candidates" ("id", "batch_id", "filename", "file_path", "upload_date", "status") VALUES (27, 10, 'Mickaelson Delva.pdf', 'uploads\resume-1762638777596-649281003.pdf', '2025-11-08 21:52:58', 'error') ON CONFLICT DO NOTHING;
INSERT INTO "candidates" ("id", "batch_id", "filename", "file_path", "upload_date", "status") VALUES (28, 10, 'Nathan Honer.pdf', 'uploads\resume-1762638777597-890292480.pdf', '2025-11-08 21:52:58', 'error') ON CONFLICT DO NOTHING;
INSERT INTO "candidates" ("id", "batch_id", "filename", "file_path", "upload_date", "status") VALUES (29, 11, 'Jonathon Dominguez.pdf', 'uploads\resume-1762638999435-344101455.pdf', '2025-11-08 21:56:39', 'error') ON CONFLICT DO NOTHING;
INSERT INTO "candidates" ("id", "batch_id", "filename", "file_path", "upload_date", "status") VALUES (30, 11, 'Michael Adams.pdf', 'uploads\resume-1762638999436-172728595.pdf', '2025-11-08 21:56:39', 'error') ON CONFLICT DO NOTHING;
INSERT INTO "candidates" ("id", "batch_id", "filename", "file_path", "upload_date", "status") VALUES (31, 11, 'Mickaelson Delva.pdf', 'uploads\resume-1762638999436-505280490.pdf', '2025-11-08 21:56:39', 'error') ON CONFLICT DO NOTHING;
INSERT INTO "candidates" ("id", "batch_id", "filename", "file_path", "upload_date", "status") VALUES (32, 12, 'Jamel Lindsay.pdf', 'uploads\resume-1762639396288-105845601.pdf', '2025-11-08 22:03:16', 'completed') ON CONFLICT DO NOTHING;
INSERT INTO "candidates" ("id", "batch_id", "filename", "file_path", "upload_date", "status") VALUES (33, 12, 'Jared Swift.pdf', 'uploads\resume-1762639396289-576512517.pdf', '2025-11-08 22:03:22', 'completed') ON CONFLICT DO NOTHING;
INSERT INTO "candidates" ("id", "batch_id", "filename", "file_path", "upload_date", "status") VALUES (34, 13, 'Peter Walters.pdf', 'uploads\resume-1762639434386-294768522.pdf', '2025-11-08 22:03:54', 'completed') ON CONFLICT DO NOTHING;
INSERT INTO "candidates" ("id", "batch_id", "filename", "file_path", "upload_date", "status") VALUES (35, 13, 'Priyesh Patel.pdf', 'uploads\resume-1762639434387-454459421.pdf', '2025-11-08 22:03:59', 'completed') ON CONFLICT DO NOTHING;
INSERT INTO "candidates" ("id", "batch_id", "filename", "file_path", "upload_date", "status") VALUES (36, 14, 'Jamel Lindsay.pdf', 'uploads\resume-1762640010986-781022286.pdf', '2025-11-08 22:13:31', 'completed') ON CONFLICT DO NOTHING;
INSERT INTO "candidates" ("id", "batch_id", "filename", "file_path", "upload_date", "status") VALUES (37, 15, 'Jamel Lindsay.pdf', 'uploads\resume-1762640381386-104969362.pdf', '2025-11-08 22:19:41', 'completed') ON CONFLICT DO NOTHING;
INSERT INTO "candidates" ("id", "batch_id", "filename", "file_path", "upload_date", "status") VALUES (38, 16, 'Jamel Lindsay.pdf', 'uploads\resume-1762640973111-50284107.pdf', '2025-11-08 22:29:33', 'completed') ON CONFLICT DO NOTHING;
INSERT INTO "candidates" ("id", "batch_id", "filename", "file_path", "upload_date", "status") VALUES (39, 17, 'Anthony Sherman.pdf', 'uploads\resume-1762867622867-839233520.pdf', '2025-11-11 13:27:02', 'completed') ON CONFLICT DO NOTHING;
INSERT INTO "candidates" ("id", "batch_id", "filename", "file_path", "upload_date", "status") VALUES (40, 18, 'Anthony Sherman.pdf', 'uploads\resume-1763230628648-589134632.pdf', '2025-11-15 18:17:08', 'completed') ON CONFLICT DO NOTHING;
INSERT INTO "candidates" ("id", "batch_id", "filename", "file_path", "upload_date", "status") VALUES (41, 19, 'Anthony Sherman.pdf', 'uploads\resume-1763230645696-410692957.pdf', '2025-11-15 18:17:25', 'completed') ON CONFLICT DO NOTHING;
INSERT INTO "candidates" ("id", "batch_id", "filename", "file_path", "upload_date", "status") VALUES (42, 19, 'Brandon Erke.pdf', 'uploads\resume-1763230645697-949007432.pdf', '2025-11-15 18:17:32', 'completed') ON CONFLICT DO NOTHING;
INSERT INTO "candidates" ("id", "batch_id", "filename", "file_path", "upload_date", "status") VALUES (43, 19, 'Emad Ayoub.pdf', 'uploads\resume-1763230645698-418221943.pdf', '2025-11-15 18:17:40', 'completed') ON CONFLICT DO NOTHING;
INSERT INTO "candidates" ("id", "batch_id", "filename", "file_path", "upload_date", "status") VALUES (44, 19, 'Jamel Lindsay.pdf', 'uploads\resume-1763230645699-121058408.pdf', '2025-11-15 18:17:46', 'completed') ON CONFLICT DO NOTHING;
INSERT INTO "candidates" ("id", "batch_id", "filename", "file_path", "upload_date", "status") VALUES (45, 19, 'Jared Swift.pdf', 'uploads\resume-1763230645699-471358425.pdf', '2025-11-15 18:17:52', 'completed') ON CONFLICT DO NOTHING;
INSERT INTO "candidates" ("id", "batch_id", "filename", "file_path", "upload_date", "status") VALUES (46, 20, 'Anthony Sherman.pdf', 'uploads\resume-1763232686194-720435247.pdf', '2025-11-15 18:51:26', 'completed') ON CONFLICT DO NOTHING;
INSERT INTO "candidates" ("id", "batch_id", "filename", "file_path", "upload_date", "status") VALUES (47, 20, 'Brandon Erke.pdf', 'uploads\resume-1763232686195-987156542.pdf', '2025-11-15 18:51:33', 'completed') ON CONFLICT DO NOTHING;
INSERT INTO "candidates" ("id", "batch_id", "filename", "file_path", "upload_date", "status") VALUES (48, 20, 'Emad Ayoub.pdf', 'uploads\resume-1763232686198-614774567.pdf', '2025-11-15 18:51:40', 'completed') ON CONFLICT DO NOTHING;
INSERT INTO "candidates" ("id", "batch_id", "filename", "file_path", "upload_date", "status") VALUES (49, 20, 'Jamel Lindsay.pdf', 'uploads\resume-1763232686200-440353163.pdf', '2025-11-15 18:51:47', 'completed') ON CONFLICT DO NOTHING;
INSERT INTO "candidates" ("id", "batch_id", "filename", "file_path", "upload_date", "status") VALUES (50, 20, 'Jared Swift.pdf', 'uploads\resume-1763232686204-140767072.pdf', '2025-11-15 18:51:53', 'completed') ON CONFLICT DO NOTHING;
INSERT INTO "candidates" ("id", "batch_id", "filename", "file_path", "upload_date", "status") VALUES (51, 21, 'Anthony Sherman.pdf', 'uploads\resume-1763233497738-428102545.pdf', '2025-11-15 19:04:57', 'completed') ON CONFLICT DO NOTHING;
INSERT INTO "candidates" ("id", "batch_id", "filename", "file_path", "upload_date", "status") VALUES (52, 21, 'Brandon Erke.pdf', 'uploads\resume-1763233497739-26418569.pdf', '2025-11-15 19:05:04', 'completed') ON CONFLICT DO NOTHING;
INSERT INTO "candidates" ("id", "batch_id", "filename", "file_path", "upload_date", "status") VALUES (53, 21, 'Emad Ayoub.pdf', 'uploads\resume-1763233497742-817469684.pdf', '2025-11-15 19:05:11', 'completed') ON CONFLICT DO NOTHING;
INSERT INTO "candidates" ("id", "batch_id", "filename", "file_path", "upload_date", "status") VALUES (54, 21, 'Jamel Lindsay.pdf', 'uploads\resume-1763233497743-353686875.pdf', '2025-11-15 19:05:17', 'completed') ON CONFLICT DO NOTHING;
INSERT INTO "candidates" ("id", "batch_id", "filename", "file_path", "upload_date", "status") VALUES (55, 21, 'Jared Swift.pdf', 'uploads\resume-1763233497746-901898077.pdf', '2025-11-15 19:05:24', 'completed') ON CONFLICT DO NOTHING;
INSERT INTO "candidates" ("id", "batch_id", "filename", "file_path", "upload_date", "status") VALUES (56, 22, 'Anthony Sherman.pdf', 'uploads\resume-1763233641852-351664253.pdf', '2025-11-15 19:07:21', 'completed') ON CONFLICT DO NOTHING;
INSERT INTO "candidates" ("id", "batch_id", "filename", "file_path", "upload_date", "status") VALUES (57, 22, 'Brandon Erke.pdf', 'uploads\resume-1763233641852-17959758.pdf', '2025-11-15 19:07:30', 'completed') ON CONFLICT DO NOTHING;
INSERT INTO "candidates" ("id", "batch_id", "filename", "file_path", "upload_date", "status") VALUES (58, 22, 'Emad Ayoub.pdf', 'uploads\resume-1763233641853-580460046.pdf', '2025-11-15 19:07:36', 'completed') ON CONFLICT DO NOTHING;
INSERT INTO "candidates" ("id", "batch_id", "filename", "file_path", "upload_date", "status") VALUES (59, 22, 'Jamel Lindsay.pdf', 'uploads\resume-1763233641854-750366725.pdf', '2025-11-15 19:07:43', 'completed') ON CONFLICT DO NOTHING;
INSERT INTO "candidates" ("id", "batch_id", "filename", "file_path", "upload_date", "status") VALUES (60, 22, 'Jared Swift.pdf', 'uploads\resume-1763233641855-611624811.pdf', '2025-11-15 19:07:50', 'completed') ON CONFLICT DO NOTHING;
INSERT INTO "candidates" ("id", "batch_id", "filename", "file_path", "upload_date", "status") VALUES (61, 23, 'Anthony Sherman.pdf', 'uploads\resume-1763234040252-663017844.pdf', '2025-11-15 19:14:00', 'completed') ON CONFLICT DO NOTHING;
INSERT INTO "candidates" ("id", "batch_id", "filename", "file_path", "upload_date", "status") VALUES (62, 23, 'Brandon Erke.pdf', 'uploads\resume-1763234040253-793489589.pdf', '2025-11-15 19:14:06', 'completed') ON CONFLICT DO NOTHING;
INSERT INTO "candidates" ("id", "batch_id", "filename", "file_path", "upload_date", "status") VALUES (63, 23, 'Emad Ayoub.pdf', 'uploads\resume-1763234040256-667050336.pdf', '2025-11-15 19:14:13', 'completed') ON CONFLICT DO NOTHING;
INSERT INTO "candidates" ("id", "batch_id", "filename", "file_path", "upload_date", "status") VALUES (64, 23, 'Jamel Lindsay.pdf', 'uploads\resume-1763234040257-881786764.pdf', '2025-11-15 19:14:19', 'completed') ON CONFLICT DO NOTHING;
INSERT INTO "candidates" ("id", "batch_id", "filename", "file_path", "upload_date", "status") VALUES (65, 23, 'Jared Swift.pdf', 'uploads\resume-1763234040262-840434982.pdf', '2025-11-15 19:14:26', 'completed') ON CONFLICT DO NOTHING;
INSERT INTO "candidates" ("id", "batch_id", "filename", "file_path", "upload_date", "status") VALUES (66, 24, 'Anthony Sherman.pdf', 'uploads\resume-1763234242688-481451500.pdf', '2025-11-15 19:17:22', 'completed') ON CONFLICT DO NOTHING;
INSERT INTO "candidates" ("id", "batch_id", "filename", "file_path", "upload_date", "status") VALUES (67, 24, 'Brandon Erke.pdf', 'uploads\resume-1763234242688-113075997.pdf', '2025-11-15 19:17:29', 'completed') ON CONFLICT DO NOTHING;
INSERT INTO "candidates" ("id", "batch_id", "filename", "file_path", "upload_date", "status") VALUES (68, 24, 'Emad Ayoub.pdf', 'uploads\resume-1763234242689-59846092.pdf', '2025-11-15 19:17:35', 'completed') ON CONFLICT DO NOTHING;
INSERT INTO "candidates" ("id", "batch_id", "filename", "file_path", "upload_date", "status") VALUES (69, 24, 'Jamel Lindsay.pdf', 'uploads\resume-1763234242690-328320060.pdf', '2025-11-15 19:17:41', 'error') ON CONFLICT DO NOTHING;
INSERT INTO "candidates" ("id", "batch_id", "filename", "file_path", "upload_date", "status") VALUES (70, 24, 'Jared Swift.pdf', 'uploads\resume-1763234242692-106323391.pdf', '2025-11-15 19:17:47', 'completed') ON CONFLICT DO NOTHING;
INSERT INTO "candidates" ("id", "batch_id", "filename", "file_path", "upload_date", "status") VALUES (71, 25, 'Anthony Sherman.pdf', 'uploads\resume-1763234987006-392125284.pdf', '2025-11-15 19:29:47', 'completed') ON CONFLICT DO NOTHING;
INSERT INTO "candidates" ("id", "batch_id", "filename", "file_path", "upload_date", "status") VALUES (72, 25, 'Brandon Erke.pdf', 'uploads\resume-1763234987007-887951544.pdf', '2025-11-15 19:29:54', 'completed') ON CONFLICT DO NOTHING;
INSERT INTO "candidates" ("id", "batch_id", "filename", "file_path", "upload_date", "status") VALUES (73, 25, 'Emad Ayoub.pdf', 'uploads\resume-1763234987010-888885307.pdf', '2025-11-15 19:30:00', 'completed') ON CONFLICT DO NOTHING;
INSERT INTO "candidates" ("id", "batch_id", "filename", "file_path", "upload_date", "status") VALUES (74, 25, 'Jamel Lindsay.pdf', 'uploads\resume-1763234987011-593638967.pdf', '2025-11-15 19:30:08', 'completed') ON CONFLICT DO NOTHING;
INSERT INTO "candidates" ("id", "batch_id", "filename", "file_path", "upload_date", "status") VALUES (75, 25, 'Jared Swift.pdf', 'uploads\resume-1763234987014-195876989.pdf', '2025-11-15 19:30:15', 'completed') ON CONFLICT DO NOTHING;
INSERT INTO "candidates" ("id", "batch_id", "filename", "file_path", "upload_date", "status") VALUES (76, 26, 'Anthony Sherman.pdf', 'uploads\resume-1763235060117-732031234.pdf', '2025-11-15 19:31:00', 'completed') ON CONFLICT DO NOTHING;
INSERT INTO "candidates" ("id", "batch_id", "filename", "file_path", "upload_date", "status") VALUES (77, 26, 'Brandon Erke.pdf', 'uploads\resume-1763235060118-456459812.pdf', '2025-11-15 19:31:06', 'completed') ON CONFLICT DO NOTHING;
INSERT INTO "candidates" ("id", "batch_id", "filename", "file_path", "upload_date", "status") VALUES (78, 26, 'Emad Ayoub.pdf', 'uploads\resume-1763235060119-670677947.pdf', '2025-11-15 19:31:12', 'completed') ON CONFLICT DO NOTHING;
INSERT INTO "candidates" ("id", "batch_id", "filename", "file_path", "upload_date", "status") VALUES (79, 26, 'Jamel Lindsay.pdf', 'uploads\resume-1763235060119-15117986.pdf', '2025-11-15 19:31:20', 'completed') ON CONFLICT DO NOTHING;
INSERT INTO "candidates" ("id", "batch_id", "filename", "file_path", "upload_date", "status") VALUES (80, 26, 'Jared Swift.pdf', 'uploads\resume-1763235060120-451442702.pdf', '2025-11-15 19:31:26', 'completed') ON CONFLICT DO NOTHING;
INSERT INTO "candidates" ("id", "batch_id", "filename", "file_path", "upload_date", "status") VALUES (81, 27, 'Anthony Sherman.pdf', 'uploads\resume-1763237932503-838025630.pdf', '2025-11-15 20:18:52', 'error') ON CONFLICT DO NOTHING;
INSERT INTO "candidates" ("id", "batch_id", "filename", "file_path", "upload_date", "status") VALUES (82, 27, 'Brandon Erke.pdf', 'uploads\resume-1763237932503-629029102.pdf', '2025-11-15 20:18:53', 'error') ON CONFLICT DO NOTHING;
INSERT INTO "candidates" ("id", "batch_id", "filename", "file_path", "upload_date", "status") VALUES (83, 27, 'Emad Ayoub.pdf', 'uploads\resume-1763237932507-140163819.pdf', '2025-11-15 20:18:53', 'error') ON CONFLICT DO NOTHING;
INSERT INTO "candidates" ("id", "batch_id", "filename", "file_path", "upload_date", "status") VALUES (84, 27, 'Jamel Lindsay.pdf', 'uploads\resume-1763237932507-449814075.pdf', '2025-11-15 20:18:53', 'error') ON CONFLICT DO NOTHING;
INSERT INTO "candidates" ("id", "batch_id", "filename", "file_path", "upload_date", "status") VALUES (85, 27, 'Jared Swift.pdf', 'uploads\resume-1763237932510-321447374.pdf', '2025-11-15 20:18:53', 'error') ON CONFLICT DO NOTHING;
INSERT INTO "candidates" ("id", "batch_id", "filename", "file_path", "upload_date", "status") VALUES (86, 28, 'Anthony Sherman.pdf', 'uploads\resume-1763237944924-11654291.pdf', '2025-11-15 20:19:04', 'error') ON CONFLICT DO NOTHING;
INSERT INTO "candidates" ("id", "batch_id", "filename", "file_path", "upload_date", "status") VALUES (87, 28, 'Brandon Erke.pdf', 'uploads\resume-1763237944924-559950106.pdf', '2025-11-15 20:19:05', 'error') ON CONFLICT DO NOTHING;
INSERT INTO "candidates" ("id", "batch_id", "filename", "file_path", "upload_date", "status") VALUES (88, 28, 'Emad Ayoub.pdf', 'uploads\resume-1763237944925-701897769.pdf', '2025-11-15 20:19:05', 'error') ON CONFLICT DO NOTHING;
INSERT INTO "candidates" ("id", "batch_id", "filename", "file_path", "upload_date", "status") VALUES (89, 28, 'Jamel Lindsay.pdf', 'uploads\resume-1763237944925-237337232.pdf', '2025-11-15 20:19:05', 'error') ON CONFLICT DO NOTHING;
INSERT INTO "candidates" ("id", "batch_id", "filename", "file_path", "upload_date", "status") VALUES (90, 28, 'Jared Swift.pdf', 'uploads\resume-1763237944927-934490130.pdf', '2025-11-15 20:19:05', 'error') ON CONFLICT DO NOTHING;
INSERT INTO "candidates" ("id", "batch_id", "filename", "file_path", "upload_date", "status") VALUES (91, 29, 'Anthony Sherman.pdf', 'uploads\resume-1763238200499-736788604.pdf', '2025-11-15 20:23:20', 'error') ON CONFLICT DO NOTHING;
INSERT INTO "candidates" ("id", "batch_id", "filename", "file_path", "upload_date", "status") VALUES (92, 29, 'Brandon Erke.pdf', 'uploads\resume-1763238200500-420405104.pdf', '2025-11-15 20:23:21', 'error') ON CONFLICT DO NOTHING;
INSERT INTO "candidates" ("id", "batch_id", "filename", "file_path", "upload_date", "status") VALUES (93, 29, 'Emad Ayoub.pdf', 'uploads\resume-1763238200503-817547801.pdf', '2025-11-15 20:23:21', 'error') ON CONFLICT DO NOTHING;
INSERT INTO "candidates" ("id", "batch_id", "filename", "file_path", "upload_date", "status") VALUES (94, 29, 'Jamel Lindsay.pdf', 'uploads\resume-1763238200504-119514661.pdf', '2025-11-15 20:23:21', 'error') ON CONFLICT DO NOTHING;
INSERT INTO "candidates" ("id", "batch_id", "filename", "file_path", "upload_date", "status") VALUES (95, 29, 'Jared Swift.pdf', 'uploads\resume-1763238200507-970830347.pdf', '2025-11-15 20:23:21', 'error') ON CONFLICT DO NOTHING;
INSERT INTO "candidates" ("id", "batch_id", "filename", "file_path", "upload_date", "status") VALUES (96, 30, 'Anthony Sherman.pdf', 'uploads\resume-1763238305973-560737011.pdf', '2025-11-15 20:25:06', 'error') ON CONFLICT DO NOTHING;
INSERT INTO "candidates" ("id", "batch_id", "filename", "file_path", "upload_date", "status") VALUES (97, 30, 'Brandon Erke.pdf', 'uploads\resume-1763238305975-923126827.pdf', '2025-11-15 20:25:06', 'error') ON CONFLICT DO NOTHING;
INSERT INTO "candidates" ("id", "batch_id", "filename", "file_path", "upload_date", "status") VALUES (98, 30, 'Emad Ayoub.pdf', 'uploads\resume-1763238305978-219044251.pdf', '2025-11-15 20:25:06', 'error') ON CONFLICT DO NOTHING;
INSERT INTO "candidates" ("id", "batch_id", "filename", "file_path", "upload_date", "status") VALUES (99, 30, 'Jamel Lindsay.pdf', 'uploads\resume-1763238305979-229196660.pdf', '2025-11-15 20:25:07', 'error') ON CONFLICT DO NOTHING;
INSERT INTO "candidates" ("id", "batch_id", "filename", "file_path", "upload_date", "status") VALUES (100, 30, 'Jared Swift.pdf', 'uploads\resume-1763238305982-543033426.pdf', '2025-11-15 20:25:07', 'error') ON CONFLICT DO NOTHING;
INSERT INTO "candidates" ("id", "batch_id", "filename", "file_path", "upload_date", "status") VALUES (101, 31, 'Anthony Sherman.pdf', 'uploads\resume-1763238456830-643610220.pdf', '2025-11-15 20:27:36', 'error') ON CONFLICT DO NOTHING;
INSERT INTO "candidates" ("id", "batch_id", "filename", "file_path", "upload_date", "status") VALUES (102, 31, 'Brandon Erke.pdf', 'uploads\resume-1763238456830-389703086.pdf', '2025-11-15 20:27:37', 'error') ON CONFLICT DO NOTHING;
INSERT INTO "candidates" ("id", "batch_id", "filename", "file_path", "upload_date", "status") VALUES (103, 31, 'Emad Ayoub.pdf', 'uploads\resume-1763238456834-843367823.pdf', '2025-11-15 20:27:37', 'error') ON CONFLICT DO NOTHING;
INSERT INTO "candidates" ("id", "batch_id", "filename", "file_path", "upload_date", "status") VALUES (104, 31, 'Jamel Lindsay.pdf', 'uploads\resume-1763238456834-472149944.pdf', '2025-11-15 20:27:37', 'error') ON CONFLICT DO NOTHING;
INSERT INTO "candidates" ("id", "batch_id", "filename", "file_path", "upload_date", "status") VALUES (105, 31, 'Jared Swift.pdf', 'uploads\resume-1763238456837-158613983.pdf', '2025-11-15 20:27:37', 'error') ON CONFLICT DO NOTHING;
INSERT INTO "candidates" ("id", "batch_id", "filename", "file_path", "upload_date", "status") VALUES (106, 32, 'Anthony Sherman.pdf', 'uploads\resume-1763239506169-497465585.pdf', '2025-11-15 20:45:06', 'error') ON CONFLICT DO NOTHING;
INSERT INTO "candidates" ("id", "batch_id", "filename", "file_path", "upload_date", "status") VALUES (107, 32, 'Brandon Erke.pdf', 'uploads\resume-1763239506170-157375355.pdf', '2025-11-15 20:45:06', 'error') ON CONFLICT DO NOTHING;
INSERT INTO "candidates" ("id", "batch_id", "filename", "file_path", "upload_date", "status") VALUES (108, 32, 'Emad Ayoub.pdf', 'uploads\resume-1763239506172-163742244.pdf', '2025-11-15 20:45:06', 'error') ON CONFLICT DO NOTHING;
INSERT INTO "candidates" ("id", "batch_id", "filename", "file_path", "upload_date", "status") VALUES (109, 32, 'Jamel Lindsay.pdf', 'uploads\resume-1763239506174-908203830.pdf', '2025-11-15 20:45:07', 'error') ON CONFLICT DO NOTHING;
INSERT INTO "candidates" ("id", "batch_id", "filename", "file_path", "upload_date", "status") VALUES (110, 32, 'Jared Swift.pdf', 'uploads\resume-1763239506177-153282630.pdf', '2025-11-15 20:45:07', 'error') ON CONFLICT DO NOTHING;
INSERT INTO "candidates" ("id", "batch_id", "filename", "file_path", "upload_date", "status") VALUES (111, 33, 'Anthony Sherman.pdf', 'uploads\resume-1763240006557-232447554.pdf', '2025-11-15 20:53:26', 'error') ON CONFLICT DO NOTHING;
INSERT INTO "candidates" ("id", "batch_id", "filename", "file_path", "upload_date", "status") VALUES (112, 33, 'Brandon Erke.pdf', 'uploads\resume-1763240006558-749493226.pdf', '2025-11-15 20:53:27', 'error') ON CONFLICT DO NOTHING;
INSERT INTO "candidates" ("id", "batch_id", "filename", "file_path", "upload_date", "status") VALUES (113, 33, 'Emad Ayoub.pdf', 'uploads\resume-1763240006561-123335434.pdf', '2025-11-15 20:53:27', 'error') ON CONFLICT DO NOTHING;
INSERT INTO "candidates" ("id", "batch_id", "filename", "file_path", "upload_date", "status") VALUES (114, 33, 'Jamel Lindsay.pdf', 'uploads\resume-1763240006561-300878993.pdf', '2025-11-15 20:53:27', 'error') ON CONFLICT DO NOTHING;
INSERT INTO "candidates" ("id", "batch_id", "filename", "file_path", "upload_date", "status") VALUES (115, 33, 'Jared Swift.pdf', 'uploads\resume-1763240006564-883958660.pdf', '2025-11-15 20:53:27', 'error') ON CONFLICT DO NOTHING;
INSERT INTO "candidates" ("id", "batch_id", "filename", "file_path", "upload_date", "status") VALUES (116, 34, 'Anthony Sherman.pdf', 'uploads\resume-1763240101378-958672095.pdf', '2025-11-15 20:55:01', 'error') ON CONFLICT DO NOTHING;
INSERT INTO "candidates" ("id", "batch_id", "filename", "file_path", "upload_date", "status") VALUES (117, 34, 'Brandon Erke.pdf', 'uploads\resume-1763240101379-389849224.pdf', '2025-11-15 20:55:02', 'error') ON CONFLICT DO NOTHING;
INSERT INTO "candidates" ("id", "batch_id", "filename", "file_path", "upload_date", "status") VALUES (118, 34, 'Emad Ayoub.pdf', 'uploads\resume-1763240101382-308853012.pdf', '2025-11-15 20:55:02', 'error') ON CONFLICT DO NOTHING;
INSERT INTO "candidates" ("id", "batch_id", "filename", "file_path", "upload_date", "status") VALUES (119, 34, 'Jamel Lindsay.pdf', 'uploads\resume-1763240101382-335724887.pdf', '2025-11-15 20:55:02', 'error') ON CONFLICT DO NOTHING;
INSERT INTO "candidates" ("id", "batch_id", "filename", "file_path", "upload_date", "status") VALUES (120, 34, 'Jared Swift.pdf', 'uploads\resume-1763240101385-165057086.pdf', '2025-11-15 20:55:02', 'error') ON CONFLICT DO NOTHING;
INSERT INTO "candidates" ("id", "batch_id", "filename", "file_path", "upload_date", "status") VALUES (121, 35, 'Anthony Sherman.pdf', 'uploads\resume-1763240353244-263295417.pdf', '2025-11-15 20:59:13', 'error') ON CONFLICT DO NOTHING;
INSERT INTO "candidates" ("id", "batch_id", "filename", "file_path", "upload_date", "status") VALUES (122, 36, 'Mickaelson Delva.pdf', 'uploads\resume-1763241462734-547586111.pdf', '2025-11-15 21:17:42', 'error') ON CONFLICT DO NOTHING;
INSERT INTO "candidates" ("id", "batch_id", "filename", "file_path", "upload_date", "status") VALUES (123, 37, 'Jared Swift.pdf', 'uploads\resume-1763241651823-678673007.pdf', '2025-11-15 21:20:51', 'error') ON CONFLICT DO NOTHING;
INSERT INTO "candidates" ("id", "batch_id", "filename", "file_path", "upload_date", "status") VALUES (124, 38, 'Jamel Lindsay.pdf', 'uploads\resume-1763242013519-777983157.pdf', '2025-11-15 21:26:53', 'error') ON CONFLICT DO NOTHING;
INSERT INTO "candidates" ("id", "batch_id", "filename", "file_path", "upload_date", "status") VALUES (125, 39, 'Jared Swift.pdf', 'uploads\resume-1763242122584-631329093.pdf', '2025-11-15 21:28:42', 'error') ON CONFLICT DO NOTHING;
INSERT INTO "candidates" ("id", "batch_id", "filename", "file_path", "upload_date", "status") VALUES (126, 40, 'Jared Swift.pdf', 'uploads\resume-1763242237087-422299954.pdf', '2025-11-15 21:30:37', 'completed') ON CONFLICT DO NOTHING;
INSERT INTO "candidates" ("id", "batch_id", "filename", "file_path", "upload_date", "status") VALUES (127, 41, 'Jared Swift.pdf', 'uploads\resume-1763242260275-876582108.pdf', '2025-11-15 21:31:00', 'completed') ON CONFLICT DO NOTHING;
INSERT INTO "candidates" ("id", "batch_id", "filename", "file_path", "upload_date", "status") VALUES (128, 42, 'Anthony Sherman.pdf', 'uploads\resume-1763242274255-411438391.pdf', '2025-11-15 21:31:14', 'completed') ON CONFLICT DO NOTHING;
INSERT INTO "candidates" ("id", "batch_id", "filename", "file_path", "upload_date", "status") VALUES (129, 42, 'Brandon Erke.pdf', 'uploads\resume-1763242274256-957668578.pdf', '2025-11-15 21:31:20', 'completed') ON CONFLICT DO NOTHING;
INSERT INTO "candidates" ("id", "batch_id", "filename", "file_path", "upload_date", "status") VALUES (130, 42, 'Emad Ayoub.pdf', 'uploads\resume-1763242274256-362244696.pdf', '2025-11-15 21:31:28', 'completed') ON CONFLICT DO NOTHING;
INSERT INTO "candidates" ("id", "batch_id", "filename", "file_path", "upload_date", "status") VALUES (131, 42, 'Jamel Lindsay.pdf', 'uploads\resume-1763242274257-721666344.pdf', '2025-11-15 21:31:35', 'completed') ON CONFLICT DO NOTHING;
INSERT INTO "candidates" ("id", "batch_id", "filename", "file_path", "upload_date", "status") VALUES (132, 42, 'Jared Swift.pdf', 'uploads\resume-1763242274257-542026095.pdf', '2025-11-15 21:31:41', 'completed') ON CONFLICT DO NOTHING;
INSERT INTO "candidates" ("id", "batch_id", "filename", "file_path", "upload_date", "status") VALUES (133, 43, 'Anthony Sherman.pdf', 'uploads\resume-1763242323782-990937276.pdf', '2025-11-15 21:32:03', 'completed') ON CONFLICT DO NOTHING;
INSERT INTO "candidates" ("id", "batch_id", "filename", "file_path", "upload_date", "status") VALUES (134, 43, 'Brandon Erke.pdf', 'uploads\resume-1763242323782-337104506.pdf', '2025-11-15 21:32:11', 'completed') ON CONFLICT DO NOTHING;
INSERT INTO "candidates" ("id", "batch_id", "filename", "file_path", "upload_date", "status") VALUES (135, 43, 'Emad Ayoub.pdf', 'uploads\resume-1763242323783-324812528.pdf', '2025-11-15 21:32:19', 'completed') ON CONFLICT DO NOTHING;
INSERT INTO "candidates" ("id", "batch_id", "filename", "file_path", "upload_date", "status") VALUES (136, 43, 'Jamel Lindsay.pdf', 'uploads\resume-1763242323783-3758552.pdf', '2025-11-15 21:32:26', 'completed') ON CONFLICT DO NOTHING;
INSERT INTO "candidates" ("id", "batch_id", "filename", "file_path", "upload_date", "status") VALUES (137, 43, 'Jared Swift.pdf', 'uploads\resume-1763242323786-847763603.pdf', '2025-11-15 21:32:32', 'completed') ON CONFLICT DO NOTHING;
INSERT INTO "candidates" ("id", "batch_id", "filename", "file_path", "upload_date", "status") VALUES (138, 44, 'Anthony Sherman.pdf', 'uploads\resume-1763256869405-245040572.pdf', '2025-11-16 01:34:29', 'error') ON CONFLICT DO NOTHING;
INSERT INTO "candidates" ("id", "batch_id", "filename", "file_path", "upload_date", "status") VALUES (139, 45, 'Jamel Lindsay.pdf', 'uploads\resume-1763256999200-691348046.pdf', '2025-11-16 01:36:39', 'error') ON CONFLICT DO NOTHING;
INSERT INTO "candidates" ("id", "batch_id", "filename", "file_path", "upload_date", "status") VALUES (140, 46, 'Michael Adams.pdf', 'uploads\resume-1763257072621-793469048.pdf', '2025-11-16 01:37:52', 'error') ON CONFLICT DO NOTHING;
INSERT INTO "candidates" ("id", "batch_id", "filename", "file_path", "upload_date", "status") VALUES (141, 47, 'Nathan Honer.pdf', 'uploads\resume-1763257185853-563186022.pdf', '2025-11-16 01:39:45', 'error') ON CONFLICT DO NOTHING;
INSERT INTO "candidates" ("id", "batch_id", "filename", "file_path", "upload_date", "status") VALUES (142, 48, 'Brandon Erke.pdf', 'uploads\resume-1763305407032-979757035.pdf', '2025-11-16 15:03:27', 'error') ON CONFLICT DO NOTHING;
INSERT INTO "candidates" ("id", "batch_id", "filename", "file_path", "upload_date", "status") VALUES (143, 49, 'Brandon Erke.pdf', 'uploads\resume-1763306757941-681790522.pdf', '2025-11-16 15:25:57', 'completed') ON CONFLICT DO NOTHING;
INSERT INTO "candidates" ("id", "batch_id", "filename", "file_path", "upload_date", "status") VALUES (144, 50, 'ResumeArualRobles.pdf', 'uploads\resume-1763595695129-938158794.pdf', '2025-11-19 23:41:35', 'completed') ON CONFLICT DO NOTHING;
INSERT INTO "candidates" ("id", "batch_id", "filename", "file_path", "upload_date", "status") VALUES (145, 50, 'ResumeDianneAlshuwaer.pdf', 'uploads\resume-1763595695133-117219730.pdf', '2025-11-19 23:41:42', 'completed') ON CONFLICT DO NOTHING;
INSERT INTO "candidates" ("id", "batch_id", "filename", "file_path", "upload_date", "status") VALUES (146, 50, 'ResumeJJCamacho.pdf', 'uploads\resume-1763595695133-751182459.pdf', '2025-11-19 23:41:49', 'completed') ON CONFLICT DO NOTHING;
INSERT INTO "candidates" ("id", "batch_id", "filename", "file_path", "upload_date", "status") VALUES (147, 51, 'Anthony Sherman.pdf', 'uploads\resume-1763596636024-169835630.pdf', '2025-11-19 23:57:16', 'completed') ON CONFLICT DO NOTHING;
INSERT INTO "candidates" ("id", "batch_id", "filename", "file_path", "upload_date", "status") VALUES (148, 51, 'Brandon Erke.pdf', 'uploads\resume-1763596636027-576582171.pdf', '2025-11-19 23:58:00', 'completed') ON CONFLICT DO NOTHING;
INSERT INTO "candidates" ("id", "batch_id", "filename", "file_path", "upload_date", "status") VALUES (149, 51, 'Emad Ayoub.pdf', 'uploads\resume-1763596636027-933026712.pdf', '2025-11-19 23:58:45', 'completed') ON CONFLICT DO NOTHING;
INSERT INTO "candidates" ("id", "batch_id", "filename", "file_path", "upload_date", "status") VALUES (150, 52, 'Anthony Sherman.pdf', 'uploads\resume-1763596753944-533899928.pdf', '2025-11-19 23:59:13', 'completed') ON CONFLICT DO NOTHING;
INSERT INTO "candidates" ("id", "batch_id", "filename", "file_path", "upload_date", "status") VALUES (151, 51, 'Jamel Lindsay.pdf', 'uploads\resume-1763596636031-494673015.pdf', '2025-11-19 23:59:27', 'completed') ON CONFLICT DO NOTHING;
INSERT INTO "candidates" ("id", "batch_id", "filename", "file_path", "upload_date", "status") VALUES (152, 52, 'Jamel Lindsay.pdf', 'uploads\resume-1763596753945-748956102.pdf', '2025-11-19 23:59:50', 'completed') ON CONFLICT DO NOTHING;
INSERT INTO "candidates" ("id", "batch_id", "filename", "file_path", "upload_date", "status") VALUES (153, 51, 'Jared Swift.pdf', 'uploads\resume-1763596636031-446737037.pdf', '2025-11-20 00:00:05', 'completed') ON CONFLICT DO NOTHING;
INSERT INTO "candidates" ("id", "batch_id", "filename", "file_path", "upload_date", "status") VALUES (154, 53, 'Anthony Sherman.pdf', 'uploads\resume-1763596885476-972205159.pdf', '2025-11-20 00:01:25', 'completed') ON CONFLICT DO NOTHING;
INSERT INTO "candidates" ("id", "batch_id", "filename", "file_path", "upload_date", "status") VALUES (155, 53, 'Brandon Erke.pdf', 'uploads\resume-1763596885476-383208333.pdf', '2025-11-20 00:02:02', 'completed') ON CONFLICT DO NOTHING;
INSERT INTO "candidates" ("id", "batch_id", "filename", "file_path", "upload_date", "status") VALUES (156, 53, 'Emad Ayoub.pdf', 'uploads\resume-1763596885478-457053892.pdf', '2025-11-20 00:02:45', 'completed') ON CONFLICT DO NOTHING;
INSERT INTO "candidates" ("id", "batch_id", "filename", "file_path", "upload_date", "status") VALUES (157, 53, 'Jamel Lindsay.pdf', 'uploads\resume-1763596885478-272318163.pdf', '2025-11-20 00:03:27', 'completed') ON CONFLICT DO NOTHING;
INSERT INTO "candidates" ("id", "batch_id", "filename", "file_path", "upload_date", "status") VALUES (158, 53, 'Jared Swift.pdf', 'uploads\resume-1763596885480-217206124.pdf', '2025-11-20 00:03:58', 'completed') ON CONFLICT DO NOTHING;
INSERT INTO "candidates" ("id", "batch_id", "filename", "file_path", "upload_date", "status") VALUES (159, 54, 'Anthony Sherman.pdf', 'uploads\resume-1763597990774-597881729.pdf', '2025-11-20 00:19:50', 'completed') ON CONFLICT DO NOTHING;
INSERT INTO "candidates" ("id", "batch_id", "filename", "file_path", "upload_date", "status") VALUES (160, 54, 'Brandon Erke.pdf', 'uploads\resume-1763597990775-744551292.pdf', '2025-11-20 00:20:35', 'completed') ON CONFLICT DO NOTHING;
INSERT INTO "candidates" ("id", "batch_id", "filename", "file_path", "upload_date", "status") VALUES (161, 54, 'Emad Ayoub.pdf', 'uploads\resume-1763597990775-620619741.pdf', '2025-11-20 00:21:19', 'completed') ON CONFLICT DO NOTHING;
INSERT INTO "candidates" ("id", "batch_id", "filename", "file_path", "upload_date", "status") VALUES (162, 54, 'Jamel Lindsay.pdf', 'uploads\resume-1763597990775-26436585.pdf', '2025-11-20 00:21:59', 'completed') ON CONFLICT DO NOTHING;
INSERT INTO "candidates" ("id", "batch_id", "filename", "file_path", "upload_date", "status") VALUES (163, 54, 'Jared Swift.pdf', 'uploads\resume-1763597990778-878166017.pdf', '2025-11-20 00:22:30', 'completed') ON CONFLICT DO NOTHING;
INSERT INTO "candidates" ("id", "batch_id", "filename", "file_path", "upload_date", "status") VALUES (164, 55, 'ResumeDianneAlshuwaer.pdf', 'uploads\resume-1763599804896-431277843.pdf', '2025-11-20 00:50:04', 'error') ON CONFLICT DO NOTHING;
INSERT INTO "candidates" ("id", "batch_id", "filename", "file_path", "upload_date", "status") VALUES (165, 56, 'michael_rodriguez_resume.pdf', '/uploads/michael_rodriguez_resume.pdf', '2025-12-06 02:30:28', 'analyzed') ON CONFLICT DO NOTHING;
INSERT INTO "candidates" ("id", "batch_id", "filename", "file_path", "upload_date", "status") VALUES (166, 56, 'jennifer_thompson_resume.pdf', '/uploads/jennifer_thompson_resume.pdf', '2025-12-06 02:30:28', 'analyzed') ON CONFLICT DO NOTHING;
INSERT INTO "candidates" ("id", "batch_id", "filename", "file_path", "upload_date", "status") VALUES (167, 56, 'david_chen_resume.pdf', '/uploads/david_chen_resume.pdf', '2025-12-06 02:30:28', 'analyzed') ON CONFLICT DO NOTHING;
INSERT INTO "candidates" ("id", "batch_id", "filename", "file_path", "upload_date", "status") VALUES (168, 56, 'robert_martinez_resume.pdf', '/uploads/robert_martinez_resume.pdf', '2025-12-06 02:30:28', 'analyzed') ON CONFLICT DO NOTHING;
INSERT INTO "candidates" ("id", "batch_id", "filename", "file_path", "upload_date", "status") VALUES (169, 56, 'sarah_williams_resume.pdf', '/uploads/sarah_williams_resume.pdf', '2025-12-06 02:30:28', 'analyzed') ON CONFLICT DO NOTHING;
INSERT INTO "candidates" ("id", "batch_id", "filename", "file_path", "upload_date", "status") VALUES (170, 56, 'james_anderson_resume.pdf', '/uploads/james_anderson_resume.pdf', '2025-12-06 02:30:28', 'analyzed') ON CONFLICT DO NOTHING;
INSERT INTO "candidates" ("id", "batch_id", "filename", "file_path", "upload_date", "status") VALUES (171, 56, 'lisa_johnson_resume.pdf', '/uploads/lisa_johnson_resume.pdf', '2025-12-06 02:30:28', 'analyzed') ON CONFLICT DO NOTHING;
INSERT INTO "candidates" ("id", "batch_id", "filename", "file_path", "upload_date", "status") VALUES (172, 56, 'kevin_brown_resume.pdf', '/uploads/kevin_brown_resume.pdf', '2025-12-06 02:30:28', 'analyzed') ON CONFLICT DO NOTHING;
INSERT INTO "candidates" ("id", "batch_id", "filename", "file_path", "upload_date", "status") VALUES (173, 56, 'amanda_davis_resume.pdf', '/uploads/amanda_davis_resume.pdf', '2025-12-06 02:30:28', 'analyzed') ON CONFLICT DO NOTHING;
INSERT INTO "candidates" ("id", "batch_id", "filename", "file_path", "upload_date", "status") VALUES (174, 56, 'patricia_garcia_resume.pdf', '/uploads/patricia_garcia_resume.pdf', '2025-12-06 02:30:28', 'analyzed') ON CONFLICT DO NOTHING;
INSERT INTO "candidates" ("id", "batch_id", "filename", "file_path", "upload_date", "status") VALUES (175, 56, 'michelle_wilson_resume.pdf', '/uploads/michelle_wilson_resume.pdf', '2025-12-06 02:30:28', 'analyzed') ON CONFLICT DO NOTHING;
INSERT INTO "candidates" ("id", "batch_id", "filename", "file_path", "upload_date", "status") VALUES (176, 56, 'christopher_taylor_resume.pdf', '/uploads/christopher_taylor_resume.pdf', '2025-12-06 02:30:28', 'analyzed') ON CONFLICT DO NOTHING;
INSERT INTO "candidates" ("id", "batch_id", "filename", "file_path", "upload_date", "status") VALUES (177, 56, 'daniel_moore_resume.pdf', '/uploads/daniel_moore_resume.pdf', '2025-12-06 02:30:28', 'analyzed') ON CONFLICT DO NOTHING;
INSERT INTO "candidates" ("id", "batch_id", "filename", "file_path", "upload_date", "status") VALUES (178, 56, 'rebecca_martinez_resume.pdf', '/uploads/rebecca_martinez_resume.pdf', '2025-12-06 02:30:28', 'analyzed') ON CONFLICT DO NOTHING;
INSERT INTO "candidates" ("id", "batch_id", "filename", "file_path", "upload_date", "status") VALUES (179, 56, 'tyler_jackson_resume.pdf', '/uploads/tyler_jackson_resume.pdf', '2025-12-06 02:30:28', 'analyzed') ON CONFLICT DO NOTHING;
INSERT INTO "candidates" ("id", "batch_id", "filename", "file_path", "upload_date", "status") VALUES (180, 57, 'michael_rodriguez_resume.pdf', '/uploads/michael_rodriguez_resume.pdf', '2025-12-06 02:30:50', 'analyzed') ON CONFLICT DO NOTHING;
INSERT INTO "candidates" ("id", "batch_id", "filename", "file_path", "upload_date", "status") VALUES (181, 57, 'jennifer_thompson_resume.pdf', '/uploads/jennifer_thompson_resume.pdf', '2025-12-06 02:30:50', 'analyzed') ON CONFLICT DO NOTHING;
INSERT INTO "candidates" ("id", "batch_id", "filename", "file_path", "upload_date", "status") VALUES (182, 57, 'david_chen_resume.pdf', '/uploads/david_chen_resume.pdf', '2025-12-06 02:30:50', 'analyzed') ON CONFLICT DO NOTHING;
INSERT INTO "candidates" ("id", "batch_id", "filename", "file_path", "upload_date", "status") VALUES (183, 57, 'robert_martinez_resume.pdf', '/uploads/robert_martinez_resume.pdf', '2025-12-06 02:30:51', 'analyzed') ON CONFLICT DO NOTHING;
INSERT INTO "candidates" ("id", "batch_id", "filename", "file_path", "upload_date", "status") VALUES (184, 57, 'sarah_williams_resume.pdf', '/uploads/sarah_williams_resume.pdf', '2025-12-06 02:30:51', 'analyzed') ON CONFLICT DO NOTHING;
INSERT INTO "candidates" ("id", "batch_id", "filename", "file_path", "upload_date", "status") VALUES (185, 57, 'james_anderson_resume.pdf', '/uploads/james_anderson_resume.pdf', '2025-12-06 02:30:51', 'analyzed') ON CONFLICT DO NOTHING;
INSERT INTO "candidates" ("id", "batch_id", "filename", "file_path", "upload_date", "status") VALUES (186, 57, 'lisa_johnson_resume.pdf', '/uploads/lisa_johnson_resume.pdf', '2025-12-06 02:30:51', 'analyzed') ON CONFLICT DO NOTHING;
INSERT INTO "candidates" ("id", "batch_id", "filename", "file_path", "upload_date", "status") VALUES (187, 57, 'kevin_brown_resume.pdf', '/uploads/kevin_brown_resume.pdf', '2025-12-06 02:30:51', 'analyzed') ON CONFLICT DO NOTHING;
INSERT INTO "candidates" ("id", "batch_id", "filename", "file_path", "upload_date", "status") VALUES (188, 57, 'amanda_davis_resume.pdf', '/uploads/amanda_davis_resume.pdf', '2025-12-06 02:30:51', 'analyzed') ON CONFLICT DO NOTHING;
INSERT INTO "candidates" ("id", "batch_id", "filename", "file_path", "upload_date", "status") VALUES (189, 57, 'patricia_garcia_resume.pdf', '/uploads/patricia_garcia_resume.pdf', '2025-12-06 02:30:51', 'analyzed') ON CONFLICT DO NOTHING;
INSERT INTO "candidates" ("id", "batch_id", "filename", "file_path", "upload_date", "status") VALUES (190, 57, 'michelle_wilson_resume.pdf', '/uploads/michelle_wilson_resume.pdf', '2025-12-06 02:30:51', 'analyzed') ON CONFLICT DO NOTHING;
INSERT INTO "candidates" ("id", "batch_id", "filename", "file_path", "upload_date", "status") VALUES (191, 57, 'christopher_taylor_resume.pdf', '/uploads/christopher_taylor_resume.pdf', '2025-12-06 02:30:51', 'analyzed') ON CONFLICT DO NOTHING;
INSERT INTO "candidates" ("id", "batch_id", "filename", "file_path", "upload_date", "status") VALUES (192, 57, 'daniel_moore_resume.pdf', '/uploads/daniel_moore_resume.pdf', '2025-12-06 02:30:51', 'analyzed') ON CONFLICT DO NOTHING;
